,Unnamed: 0,city,company_name,description,duty,employment,experience,max_salary,min_salary,name,published_date,requirements,schedule,skills,terms
15110,15110,,ГБУ г. Москвы ИНКОЦентр,Гуру Excel ,"Обязанности: Мы занимаемся стыковкой довольно большого числа не всегда точных табличных данных. Независимо от качества источника от нас требуется привести их к максимально корректному виду в результирующей таблице, а также суметь быстро собрать необходимую сводную аналитику, иногда – построить красивый и уместный график. Кроме этого, у нас есть много аналитической работы, требующей отлаживания систем учета данных и проверок входных данных. Для этой работы нам требуется человек, который умеет действительно быстро и эффективно работать в Excel, знает его возможности, необходимые для стыковок данных, скрытые функции, горячие клавиши. Также мы все время взаимодействуем с теми, кто поставляет эти данные, чаще всего это разговоры по телефону и переписка на форуме и по электронной почте. Постоянно работаем с экономическими данными, часто пригождается знание математики. ",Полная занятость,От 1 года до 3 лет,110000.0,90000.0,Специалист Excel (эксперт),2020-10-05T15:54:23+0300,,Полный день,"[{'name': 'Математическая статистика'}, {'name': 'MS Excel'}, {'name': 'Сводные таблицы'}, {'name': 'Анализ данных'}, {'name': 'Работа с большим объемом информации'}, {'name': 'Аналитическое мышление'}, {'name': 'Базы данных'}, {'name': 'Грамотная речь'}, {'name': 'Грамотность'}, {'name': 'Программирование'}]",Необходимые условия: · Законченное высшее образование · Опыт аналитической работы с табличными данными от 2 лет · Отличное знание функционала сводных таблиц · Умение решать математические задачи · Высокий уровень грамотности · Плюсом будут навыки программирования 
7094,7094,Москва,ФОРМ,,"Обязанности: - разработка текстовой технической документации (ТЗ, ТУ, ПМ, инструкции и т.п. ) на всех этапах ОКР (НИОКР); - оформление протоколов испытаний; - разработка эксплуатационной документации; - согласование документов с органами сертификации; - ведение электронного архива; - отработка замечаний и предложений от клиентов и контролирующих органов, в том числе зарубежных; - разработка и внедрение стандартов оформления документации;   ",Полная занятость,Более 6 лет,115000.0,90000.0,Технический писатель,2020-10-13T11:02:21+0300,"Требования: - высшее техническое образование, желательно радиоэлектроника, системотехника, метрология; - опыт работы в области электроники \ радиоэлектроники обязателен; - отличное знание русского языка; - свободное владение MS Office на уровне эксперта; - отличное знание стандартов оформления текстовой документации; - знание нормативной базы и опыт в области измерительной техники, метрологии; - опыт самостоятельной разработки документации; - опыт взаимодействия с органами сертификации; - знание технического английского языка.   ",Полный день,[],"Условия: - работа в коллективе профессиональных разработчиков, нацеленных на результат. ФОРМ (FORM RU) более 20 лет обеспечивает внутренний рынок электроники своей инновационной высокотехнологичной продукцией и представляет свои результаты на зарубежном рынке; - оформление и работа - в полном соответствии с ТК РФ. Вы будете обеспечены всеми необходимыми техническими средствами и современным рабочим местом для эффективной работы; - конкурентная белая заработная плата, размер заработной платы обсуждается с успешным кандидатом по результатам собеседования; - работа на территории группы ФОРМ в БЦ West Park, c доставкой до и от метро на корпоративном автобусе."
3029,3029,,Ростелеком Контакт-центр,,"Обязанности:<br />Организация работы Ситуационного центра<br />Разработка/доработка инструкций и регламентов, касающихся работы СЦ<br />Формирование требований к доработкам СУЭ в части онлайн-мониторинга КПЭ<br />Мониторинг операционных показателей Контакт-центра в сменах 2/2<br />Первичный операционный анализ, выявление отклонений, уточнение данных и причин<br />Сбор информации по корректирующим мероприятиям<br />Информирование заинтересованных подразделений об отклонениях, причинах, корректирующих мероприятиях<br />Отправка регулярной отчётности по показателям с причинами отклонений и мероприятиями ",Полная занятость,От 1 года до 3 лет,117000.0,90000.0,Ведущий специалист ситуационного центра,2020-09-30T16:55:30+0300,"Требования:<br />Опыт работы в контакт-центре (в группе мониторинга, анализа и планирования или аналогичных подразделениях);<br />Отличное знание основных показателей работы колл-центра (назначение, формулы, методы измерения и методы установления целевых значений показателей), понимание их взаимосвязей между собой;<br />Навыки анализа данных, умение работать с большими массивами информации;<br />Высокий уровень ответственности, умение работать в режиме многозадачности. ",Полный день,[],"Условия:<br />Расположение: БЦ КомСити, ст. метро Румянцево<br />Работа в том числе в интересах крупнейших компаний федерального уровня (ВТБ ПАО, Ростелеком, Госуслуги, Tele2, Азбука вкуса, QIWI и других);<br />Высокий уровень оплаты труда (оклад + ежемесячные/квартальные/годовые бонусы) - итоговый уровень вознаграждения обсуждается индивидуально с успешными соискателями на финальных этапах оценки;<br />Официальное трудоустройство, полное соблюдение трудового законодательства РФ и дополнительные корпоративные бонусы;<br />Амбициозные задачи, работа в Компании-лидере рынка и в команде профессионалов;"
2929,2929,Москва,SF Education,"Мы онлайн-университет «SF Education», задача которого - высококлассное обучение финансам, инвестициям, анализу данных и менеджменту, а также дальнейшее трудоустройство и карьерный рост выпускников. Работаем с 2013 года. Входим в топ-30 Edtech компаний России по версии РБК. Для нас важен устойчивый рост (sustainable growth): тонкий баланс между коммерческими результатами и качеством продукта. Мы бережем свою репутацию. Мы ищем аккуратного PHP-разработчика, готового к воплощению новых задач, а также доработке и улучшению существующих скриптов. ",,Полная занятость,От 1 года до 3 лет,110000.0,100000.0,PHP Developer,2020-10-14T18:25:41+0300,,Гибкий график,"[{'name': 'MySQL'}, {'name': 'PHP7'}, {'name': 'PHP'}, {'name': 'MVC'}]","Мы предлагаем отличные условия: Гибкий график работы (время прихода на работу в интервале с 9 до 12) и отсутствие дресс-кода;Возможность прохождения любых дистанционных курсов SF Education, а еще корпоративную скидку на изучение английского языка в Skyeng;ежемесячное вознаграждение на время испытательного срока 90-100 тысяч рублей на руки, после успешного прохождения испытательного срока +10 тысяч рублей на руки;испытательный срок - 3 месяца;после успешного прохождения испытательного срока - переход на режим частично удаленной работы (2 дня в неделю из дома);работа в центре Москвы (м. Охотный ряд, Театральная, Кузнецкий мост)."
11645,11645,Москва,Газпром Недра,,"Обязанности: — Выполнение комплекса мероприятий по ФЗ-152; — Конфиденциальное делопроизводство в подразделении; — Контроль за использованием средств криптографической защиты информации; — Согласование и учет заявок на доступы к информационным ресурсам; — Совершенствование нормативно-методических документов по защите информации; — Разработка технических требований на подсистемы обеспечения ИБ, контроль их внедрения; — Проведение работ по идентификации, классификации и учету объектов защиты, разработке модели угроз, потенциальных нарушителей; — Проведение проверок информационных систем на соответствие требованиям ИБ в подразделениях и филиалах Общества; — Реагирование на инциденты информационной безопасности и их расследование; — Мониторинг и анализ событий информационной безопасности; — Сбор, актуализация и анализ данных о состоянии информационной безопасности в филиалах и подразделениях Общества; — Разработка планов по устранению выявленных недостатков и совершенствованию системы обеспечения ИБ и контроль их выполнения; — Координация деятельности работников ответственных за информационную безопасность филиалах Общества; — Контроль выполнения требований нормативных документов, регламентирующих порядок обеспечения режима коммерческой тайны, обработки и защиты персональных данных, ведения конфиденциального делопроизводства; — Подготовка необходимых материалов (отчетов, актов, планов работ, протоколов и т. д.). ",Полная занятость,От 3 до 6 лет,110000.0,105000.0,Главный специалист по информационной безопасности,2020-10-07T12:41:09+0300,"Обязанности: — Выполнение комплекса мероприятий по ФЗ-152; — Конфиденциальное делопроизводство в подразделении; — Контроль за использованием средств криптографической защиты информации; — Согласование и учет заявок на доступы к информационным ресурсам; — Совершенствование нормативно-методических документов по защите информации; — Разработка технических требований на подсистемы обеспечения ИБ, контроль их внедрения; — Проведение работ по идентификации, классификации и учету объектов защиты, разработке модели угроз, потенциальных нарушителей; — Проведение проверок информационных систем на соответствие требованиям ИБ в подразделениях и филиалах Общества; — Реагирование на инциденты информационной безопасности и их расследование; — Мониторинг и анализ событий информационной безопасности; — Сбор, актуализация и анализ данных о состоянии информационной безопасности в филиалах и подразделениях Общества; — Разработка планов по устранению выявленных недостатков и совершенствованию системы обеспечения ИБ и контроль их выполнения; — Координация деятельности работников ответственных за информационную безопасность филиалах Общества; — Контроль выполнения требований нормативных документов, регламентирующих порядок обеспечения режима коммерческой тайны, обработки и защиты персональных данных, ведения конфиденциального делопроизводства; — Подготовка необходимых материалов (отчетов, актов, планов работ, протоколов и т. д.). ",Полный день,"[{'name': 'Персональные данные'}, {'name': 'Информационная безопасность'}, {'name': 'Проведение внутренних расследований'}, {'name': 'ФЗ-152'}, {'name': 'коммерчесская тайна'}, {'name': 'защита информации'}, {'name': 'Аудит безопасности'}, {'name': 'Kaspersky Labs'}, {'name': 'SEIM (HP ArcSight ESM)'}, {'name': 'Cisco'}, {'name': 'Check Point'}]",Условия: График работы с 09-00 до 18-00 (пт. 16-45);Современный офис в пешей доступности от метро;Столовая на территории офиса;Оформление по ТК;Оплачиваемый отпуск 28 календарных дней + дополнительные дни;ДМC;Льготное кредитование;Профсоюз;Возможность обучения;Спортивные мероприятия.
9049,9049,,АСБК софт,,"Обязанности: Управление проектами: - предпроектное обследование, участие в пресейл-встречах, подготовка коммерческих предложений, оценка трудоемкости и сроков реализации проекта, подготовка презентации проекта и защита его перед заказчиком; - составление и согласование технического задания со всеми заинтересованными сторонами; - организация работы проектной команды: составление детального плана работ, декомпозиция задач, их распределение, контроль выполнения и соблюдения сроков; - взаимодействие с заказчиком на всех этапах реализации проектов, оценка рисков, предложение компенсационных мер; - оценка достигнутых результатов и сдача проектов.   ",Полная занятость,От 3 до 6 лет,110000.0,110000.0,Руководитель проектов,2020-10-13T16:33:09+0300,"Требования: Релевантный опыт работы в ИТ сфере на аналогичной должности не менее 3 лет;Высшее техническое образование;Опыт описания бизнес-процессов;Опыт составления и ведения проектной документации;Выявление, анализ и формализация требований заказчиков.Опыт написания проектной документации;Умение вести переговоры, доказывать свою точку зрения заказчику;Знание основ программирования, основ построения архитектур ИТ-систем;Отсутствие проблем с общением и коммуникацией с коллегами, заказчиком, соисполнителями.Желателен опыт работы с государственным заказчиком.   ",Полный день,"[{'name': 'Управление проектами'}, {'name': 'MS Project'}, {'name': 'Бизнес-анализ'}, {'name': 'MS Visio'}, {'name': 'Управление рисками'}, {'name': 'Разработка проектной документации'}, {'name': 'Деловая коммуникация'}, {'name': 'Навыки презентации'}, {'name': 'Системный анализ'}, {'name': 'Подготовка презентаций'}, {'name': 'Проектная документация'}, {'name': 'Управление временем'}, {'name': 'Работа в команде'}, {'name': 'Анализ рисков'}, {'name': 'Информационные технологии'}]","Условия: Уровень заработной платы будет определяться по результатам собеседования, в зависимости от уровня квалификации;Оформление в соответствии с ТК РФ;Оплата переработок;Работа на территории заказчика или в офисе компании;Бесплатное обучение и сертификация;Компенсация обучения по предметным областям и информационным технологиям, востребованным в работе;Перспективы карьерного роста;Социальный пакет: Еженедельные бесплатные корпоративные спортивные мероприятия – футбол, волейбол; Специальные условия потребительского и ипотечного кредитования в банке-партнере.  "
