,Unnamed: 0,city,company_name,description,duty,employment,experience,max_salary,min_salary,name,published_date,requirements,schedule,skills,terms
13035,13035,,Авалон,,"Обязанности: Обработка входящих заявок.Подбор и просчет оборудования по техническому заданию конкурсной документации, заданию на логистику.Квалификация торгово-закупочных процедур для участия в них по портфелю товарных групп компании. Заполнение форм технического задания торгово-закупочных процедур по 223 и 44 Ф.З.Работа с поставщиками, заключение договоров, получение КП и счетов от поставщика, сверка полученных данных с Т.З. заказчика.Работа с корпоративными клиентами совместно с ведущим менеджером, расширение присутствия внутри заказчика.Участие в формирование технико-коммерческих предложений.Участие в разработке проектных сделок.Консультирование заказчиков по стадиям ведения проекта, ведение телефонных переговоров, урегулирование проблем, согласование замен. ",Полная занятость,От 3 до 6 лет,60000.0,50000.0,Менеджер отдела сопровождения продаж,2020-10-15T17:22:34+0300,"Требования: Знание ПК на уровне уверенного пользователя.Приветствуется знание 1С Бухгалтерия.Активная жизненная позиция.Желание построить карьеру в крупной компании.Высокая работоспособность.Ответственность.Быстрая обучаемость.Развитые коммуникативные навыки.Опыт работы от 5 лет.Нечастые командировки.Знание основных игроков на рынке среди производителей, дистрибьюторов оборудования. ",Полный день,[],"Условия: Повышение квалификации.Оформление: отпуск, больничный и пр. по ТК РФ.Технические тренинги - по направлению энергетика (вторичка).График работы 5/2 с Пн. -Чт. (09.00-18.00), в Пт. (09.00-18.00).Работа строго в центральном офисе компании.Возможность карьерного роста.Коллектив единомышленников.Отсутствие дресс-кода."
13408,13408,Москва,Группа компаний Регионы,Сеть кинотеатров приглашает на работу системного администратора. ,"Обязанности: Поддержка работы основных систем кинотеатра (Премьера4, R-keeper7); Поддержка работы онлайн-касс и терминалов самообслуживания; Администрирование базовых сервисов: Active Directory, DNS, DHCP, рабочие места пользователей; Поддержка сетевой инфраструктуры: сетевое оборудование, VPN, Wi-Fi Ubiquiti; Обеспечение безопасности сети, контроль доступа, антивирус; Резервное копирование (Veeam Backup); Оптимизация текущих сервисов, обеспечение бесперебойной работы кинотеатра по IT; Ведение документации ИТ; Работа по заявкам HelpDesk. ",Полная занятость,От 1 года до 3 лет,60000.0,50000.0,Системный администратор,2020-09-17T16:46:38+0300,"Требования: Высшее или неоконченное высшее образование (желательно профильное); Опыт работы от 2-х лет. Опыт работы с кассовым оборудованием; Знание продуктов Microsoft (Windows XP,7,8,10, Windows Server); Знание и опыт администрирования средств виртуализации VMWare; Опыт администрирования корпоративных систем рез. копирования, антивирусов; Понимание принципов ip-телефонии; Опыт работы с сетевым оборудованием, СКУД, видеонаблюдение. ",Сменный график,"[{'name': 'Active Directory'}, {'name': 'DHCP'}, {'name': 'Windows Server 2003'}, {'name': 'VMware'}, {'name': 'Настройка DNS'}]","Условия: м.Молодежная, ТРЦ КУНЦЕВО ПЛАЗА График работы 2/2 с 10.00 до 22.00. ЗП по результата собеседования.      "
14636,14636,,Дейта Кью,"Привет! Меня зовут Лера Таныгина, я руковожу службой поддержки DaData.ru. Я ищу к себе в команду человека, которому интересно решать проблемы пользователей. При этом много общаться и добираться до сути каждого обращения. «Дадата» — это облачный сервис, который приводит в порядок и дополняет контактные данные: адреса, ФИО, телефоны, емейлы, реквизиты юрлиц. Каждый день «Дадату» используют тысячи компаний, обрабатывая данные миллионов клиентов. ",,Полная занятость,Нет опыта,60000.0,50000.0,Специалист службы поддержки,2020-10-08T19:11:12+0300,,Удаленная работа,[],
16496,16496,Москва,Top 3D Group,"Top 3D Group уже более 6 лет занимается поставками, сервисом и наладкой профессионального и персонального 3D-оборудования. В 2020 году мы поставили цель достигнуть оборота в 1 млрд. рублей и активно идем к цели. На сегодняшний день в России компания занимает лидирующую позицию на рынке 3D-оборудования. Мы предлагаем интересную и яркую работу, которая позволит энергичным и амбициозным сотрудникам стать профессионалами в области технологий 3D-печати. Мы ищем не просто",Обязанности:  продажа расходных материалов и 3D оборудования  развитие продаж и расширение существующего портфеля клиентов  подготовка коммерческих предложений  заключение договоров  работа с дебиторской задолженностью  планирование продаж  ведение CRM  достижение количественных и качественных показателей  активное участия в Event мероприятиях и расширении коммуникативных связей  ,Полная занятость,От 1 года до 3 лет,60000.0,50000.0,Менеджер интернет-магазина,2020-09-17T17:15:20+0300,"Требования:  Высшее образование, неоконченное высшее.  Опыт работы в торговых компаниях.  Опыт работы в продажах оборудования от года (желателен).  Понимание методик работы по короткому и среднему циклу сделки.  Грамотная письменная и устная речь.  Навыки переговоров и коммуникативные навыки.  Компьютерная грамотность, навыки работы в CRM.  Способность доводить сделки до логического завершения.  Способность обучаться и использовать новые знания в работе.  ",Полный день,"[{'name': 'Ведение переговоров'}, {'name': 'Развитие продаж'}, {'name': 'Управление продажами'}, {'name': 'Обучение и развитие'}, {'name': 'Активные продажи'}, {'name': 'Прямые продажи'}, {'name': 'Деловая коммуникация'}, {'name': 'Грамотная речь'}, {'name': 'Деловое общение'}, {'name': 'CRM'}, {'name': 'Навыки переговоров'}, {'name': 'Продажи через интернет'}, {'name': 'Работа в команде'}]","Условия:  Рынок – Работа на реактивно растущем рынке технологий будущего;  Работа у лидера рынка – Наши планы амбициозны, наши цели четкие, высокая востребованность на рынке – динамичный темп работы, громкие проекты;  Ваши наставники – эксперты рынка аддитивных технологий;  Обязательное развитие – повышение квалификации у сильнейшей команды рынка бесплатно для наших сотрудников; программа обучения на удобной on-line платформе;  Карьера – в компании всегда есть высокие задачи для успешных и компетентных сотрудников. Большая часть коллектива повысила свои позиции в компании  Самый широкий товарный портфель на рынке, с возможностью осуществлять продажи под индивидуальные запросы конкретных клиентов из разных отраслей.  Достойная оплата (Оклад и процент. Лимита нет). Гибкая система выплаты заработной платы.  Возможен быстрый вертикальный и горизонтальный рост.  Для сотрудников с продолжительным стажем работы в компании предусмотрены корпоративные скидки на изучение английского языка и компенсация проезда.  Кредит от компании.  Уютный офис в одном из лучших технопарков Москвы - Калибр, в 5-ти минутах ходьбы от м. Алексеевская. График: 5/2, 10.00-19.00.  Комфортное рабочее место с современной техникой.  Питание: можно перекусить на оборудованных кухнях (завтраки, фрукты), на территории технопарка расположена качественная недорогая столовая.  Социальная ответственность: материальная помощь, подарочный сертификат при рождении ребенка.   Корпоративное обучение высокого уровня: онлайн и офлайн тренинги.  Освоение новых технологий, участие в крупных выставках, митапах и конференциях.  Возможность принять участие в организуемой компанией собственной регулярной международной выставке-конференции Top 3D Expo, проводимой два раза в год и привлекающей более 1000 профессионалов отрасли.   Молодая команда профессионалов и отличная рабочая атмосфера. Мы собрали лучших в своем деле специалистов.  Частые и не унылые корпоративы и неформальное общение  Корпоративная организация совместных спортивных мероприятий (волейбол, баскетбол, футбол).  Наша основная цель найти не просто исполнителя, а действительно близкого нам по духу и ДНК компании человека, который любит технологии и который будет любить свою работу не только за возможность получать здесь деньги, но и разделять принципы и ценности компании, будет драйвером роста своего направления, будет любить то, что он делает. Человек, который не только принесет и внедрит свой профессиональный опыт в механизмы работы компании, но и сделает все, чтобы развить свои профессиональные навыки в растущей х2 год к году последние 6 лет компании. С нас поощрение любых инициатив, мотивация и помощь с профессиональным ростом и развитием, неограниченный &quot;потолок&quot; оплаты труда. "
16644,16644,Москва,Государственная академия наук Российская академия образования,,"Обязанности: Подготовка и проведение видео-конференций на площадках TrueConf, Zoom, взаимодействие с техподдержкой площадки TrueConf;поддержка системы дистанционного обучения Mirapolis LMS;настройка и ремонт компьютерной техники;настройка коммутационного оборудования;установка операционных систем и офисных приложений. ",Полная занятость,От 3 до 6 лет,60000.0,50000.0,Главный специалист отдела информационных технологий,2020-10-05T12:19:50+0300,Требования: высшее техническое образование;опыт работы в области информационных технологий не менее 3 лет ,Полный день,"[{'name': 'Настройка сетевых подключений'}, {'name': 'Ремонт ПК'}, {'name': 'Информационные технологии'}, {'name': 'Организация конференций'}, {'name': 'Техническая поддержка'}, {'name': 'Администрирование серверов Windows'}]",Условия: Работа в бюджетном учреждении по ТК РФ.Пятидневка
9019,9019,Москва,ХАТОН ГРУПП,Мы компания &quot;,"⭐ Должностные обязанности: Обработка &quot;горячих&quot; заявок с сайта компании (только входящие заявки);Выявление потребностей, первичный опрос клиента;Приглашение в офис компании для заключения договора; ",Полная занятость,Нет опыта,65000.0,50000.0,Администратор/Оператор Call-центра,2020-10-14T10:26:49+0300,,Полный день,[],"Хатон Кредит&quot;. Наша основная задача это - проконсультировать клиента и помочь клиенту получить кредит в банке Москвы на самых выгодных условиях, являемся прямыми партнерами банков. "
14186,14186,Москва,Спецмонтаж,"Наша компания занимается монтажом и наладкой слаботочных систем на Жилых комплексах и Бизнес-центрах Москвы и Московской области. Все объекты - это строящиеся жилые комплексы. Стройка! Где нужно ходить в каске, работать как внутри помещений, так и снаружи, на крыше и в подвале. Основные задачи: Монтаж кабеля в гофре и кабель-канале, штробление стен электроинструментом, монтаж металлических лотков, установка и подключение оборудования. Основные локации в данный момент: метро Мякинино, Котельники и Динамо. Если ты имеешь опыт работы с электроинструментом, аккуратен в работе и готов учиться и развиваться, то тебе к нам! ","Обязанности: Монтаж кабельных трасс (системы АПС, СВН, ОС, СОУЭ, ЛВС, Оптические линии связи);Монтаж оборудования АПС и СОУЭ, Видеонаблюдения, СКУД, ЛВС;Монтаж слаботочных лотков;Выполнение планов по объему работ;Выполнение поручений непосредственного руководителя; ",Полная занятость,От 1 года до 3 лет,65000.0,50000.0,Монтажник слаботочных систем,2020-10-05T09:21:36+0300,Требования: Опыт работы монтажником слаботочных систем;Соблюдение правил техники безопасности;Опыт работы с электроинструментом;Наличие допусков и разрешений приветствуется. ,Полный день,"[{'name': 'Системы видеонаблюдения'}, {'name': 'Монтаж инженерных систем'}, {'name': 'Электрические системы и слаботочные системы'}, {'name': 'слаботочные системы'}, {'name': 'Системы охранно-тревожной сигнализации'}, {'name': 'Производство строительно-монтажных работ'}, {'name': 'Производство пусконаладочных работ'}, {'name': 'Монтаж оборудования'}]",Условия: Объекты в г. Москва и Московской области;Обучение;График 5\2.Официальное трудоустройство;Полностью &quot;Белая&quot; оплата труда;Возможность карьерного роста;Премия по результатам сдачи объекта; Адрес объекта указан в вакансии
14282,14282,Москва,"ПРОФИ, сеть магазинов",,Должностные обязанности: Осуществление мелкого ремонта следующих позиций: блоки питания;паяльные станции;ультразвуковые ванны;лупы настольные;весы карманные(редко);мультиметры(редко);паяльные ванны(редко);строительные фены(редко). ,Полная занятость,От 1 года до 3 лет,65000.0,50000.0,Специалист по ремонту оборудования,2020-10-09T10:15:03+0300,Требования: ответственность;опыт в ремонте оборудования. ,Полный день,"[{'name': 'ремонт электронного оборудования'}, {'name': 'ремонт паяльных станций, ультразвуковых ванн'}, {'name': 'ремонт блоков питания'}, {'name': 'умение паять'}, {'name': 'чтение микросхем'}]","Условия: интересная работа в крупной розничной компании с 20-летней историей;оформление по ТК РФ с первого рабочего дня;офис м. Беговая, рабочий день 5/2, с 8.00 до 17.00 без задержек ;оформление по Трудовому кодексу РФ с первого рабочего дня, оплата отпусков и больничных листов;корпоративные мероприятия, конкурсы и мотивационные программы;карьерный рост и профессиональное развитие;дружный молодой коллектив.план 250 ремонтов в месяц (на испыт. срок 50тыс.,после 50тыс. при выполнении плана + 5тыс. за каждые 50 наименований), объемы есть,по итогам работы возможно сокращение испытательного срока. <ul> </ul>"
14737,14737,Москва,Асмодей+,,"Обязанности: Закупка, настройка, и ремонт ПК и периферийного оборудованияУстановка и настройка ОС Windows, офисного ПО и антивирусной защитыВыполнение поручений руководителяАдминистрирование локальных сетей ",Полная занятость,От 1 года до 3 лет,65000.0,50000.0,Специалист технической поддержки,2020-10-15T17:23:21+0300,"Требования: Опыт работы в аналогичной должности не менее 1 годаЗнание Microsoft Windows 7/10 и Microsoft Office на уровне уверенного пользователяОпыт работы с торговым оборудованием: ККМ, весы, ТСД ",Полный день,"[{'name': 'Офисная техника'}, {'name': 'Windows Os'}, {'name': 'Ремонт ПК'}, {'name': 'Настройка ПК'}, {'name': 'Настройка сетевых подключений'}]",Условия: Офис рядом с метроБесплатные обедыСкидка на продукцию компании
