,Unnamed: 0,city,company_name,description,duty,employment,experience,max_salary,min_salary,name,published_date,requirements,schedule,skills,terms
14730,14730,,НПП Бевард,,Обязанности: Ремонт оборудования на компонентном уровнеТестирование оборудования и диагностика неисправности ,Полная занятость,От 1 года до 3 лет,50000.0,50000.0,Инженер по ремонту электроники,2020-10-02T10:27:02+0300,"Требования: Умение работать термовоздушной паяльной станцией, КИПомУмение читать эл/схемыТребуется опыт пайки SMD или BGA <br />",Полный день,[],Условия: Офис находится по адресу: г. Москва‚ ул.Миклухо-Маклая (ближайшие станции метро Беляево или Юго-Западная)Рабочий день с 09.00 до 18.005 дневная рабочая неделяОформление по ТК
15506,15506,Химки,АТЛАНТ,,,Полная занятость,От 1 года до 3 лет,50000.0,50000.0,Инженер технической поддержки/HelpDesk,2020-10-14T15:17:33+0300,"Требования: Умение диагностировать и устранять неисправности в ПК, комплектующих и оргтехники;Уверенные знания и опыт работы с клиентскими ОС Windows 7/8/10;Понимание принципов функционирования сетей TCP/IP;Опыт прокладки СКС, коммутирования сетевых розеток;Техническая грамотность. Умение излагать свои мысли, описывать проблемы и свои действия;Опыт работы с торговым кассовым оборудованием желателен; ",Сменный график,"[{'name': 'Helpdesk'}, {'name': 'Техническая поддержка'}, {'name': 'Ремонт ПК'}, {'name': 'Настройка ПК'}, {'name': 'Настройка ПО'}, {'name': 'Windows Xp'}, {'name': 'Windows 7'}, {'name': 'Администрирование сетевого оборудования'}, {'name': 'Выездное обслуживание'}, {'name': 'Техническое обслуживание'}, {'name': 'Сборка ПК'}, {'name': 'Настройка сетевых подключений'}]","Условия: Место работы г.Химки Транспортный проезд д.7;График работы сменный 2/2 по 12 часов;Оформление с первого рабочего дня (оплачиваемые больничный и отпуск);Компенсация ГСМ при использовании автомобиля в служебных целях;Есть корпоративный транспорт от г.Солнечногорск, г.Зеленоград, жд.ст.Химки."
16941,16941,Москва,АйТи Энерджи Сервис,,Обязанности: установка и настройка средства вычислительной техники и информатики (далее СВТИ)установка и настройка операционных систем и ПО общего и специализированного назначенияпрофилактическое обслуживание СВТИ и ПОдиагностика и устранение неисправностей СВТИ и ПОконсультирование пользователей ,Полная занятость,От 1 года до 3 лет,50000.0,50000.0,Главный специалист технической поддержки,2020-09-22T14:10:37+0300,"Требования: образование высшее техническоезнание &quot;железа&quot; (архитектуры СВТИ)глубокие знания ОС семейства Windows, пакета MS Office (Word, Exсel, MS Outlook)навыки по установке и настройке ПОзнание особенностей работы ПК в доменах (AD)знание основ работы вычислительных сетей и сетевых протоколов TCP/ IPтехническая поддержка ПК пользователейсистемное администрированиеприветствуются профильные сертификаты MicrosoftОС семейства Windows - продвинутый уровеньMS Office (Word, Exсel, Outlook) - продвинутый уровень ",Полный день,"[{'name': 'Настройка сетевых подключений'}, {'name': 'Настройка ПК'}, {'name': 'TCP/IP'}, {'name': 'Настройка ПО'}, {'name': 'Ремонт ПК'}]","Условия: оформление в соответствии с ТК РФ, ДМС после испытательного срокатехническая поддержка ПК пользователей на площадке(ах) заказчика (в ближайшее время – в офисе у м. Проспект Мира или на ул. Беловежская, 4), местные командировки на другие территориииспытательный срок - 3 месяцазаработная плата выплачивается без задержекуровень оплаты труда - обсуждается с кандидатами при собеседовании и зависит от опыта и квалификации"
1323,1323,Москва,Комс,Мы резиденты инновационного центра “Сколково” и у нас уже есть крупные и очень крупные клиенты. Мы хотим развиваться и расти не теряя скорости и качества работы с нашими клиентами. Ищем в нашу команду Coms ,,Полная занятость,От 1 года до 3 лет,55000.0,50000.0,Инженер технической поддержки,2020-10-13T08:58:47+0300,"Требования:  Базовое знание Linux, умение работать с командной строкой.  Знание сетевых технологий и протоколов.  Опыт работы с системами мониторинга (желательно Zabbix).  Ответственность, обучаемость, способность работать в команде.  Приветствуется опыт работы в технической поддержке.  Большим плюсом будет опыт работы в операторах связи.    ",Сменный график,"[{'name': 'Linux'}, {'name': 'Работа в команде'}, {'name': 'Деловое общение'}, {'name': 'Windows 7'}, {'name': 'Электронная почта'}]","Условия:    Сменная работа: график 3/1, смены по 8 часов. На время пандемии работа удаленная.   Оформления по ТК РФ.  Белая заработная плата.  Офис в центре Москвы. "
2551,2551,Котельники,ВсеИнструменты.ру,"ВсеИнструменты.ру. Сегодня за нашими плечами 14 лет развития, роста и результата. Благодаря нашим сотрудникам, мы – лидеры продаж на рынке строительного оборудования и инструмента. О нашем успехе говорит следующее: 14-е место в мире в сегменте Home and Garden за 2019 год;10-е место в рейтинге топ-100 крупнейших интернет-магазинов России за 2019 год;30-е место в рейтинге топ-100 лучших работодателей России от HeadHunter за 2019 год;На протяжении пяти лет ежегодно получаем звание «Привлекательный работодатель». Наш IT отдел - это коллектив численностью 160 человек, постоянно развивающиеся проекты и новые технологии. ",,Полная занятость,От 1 года до 3 лет,55000.0,50000.0,Системный администратор / Специалист технической поддержки,2020-09-28T12:10:43+0300,,Гибкий график,[],
5713,5713,,ГУП Мосгортранс,,"Обязанности: Организация рабочих мест пользователейУстановка и настройка операционных систем, необходимого программного обеспечения на рабочие места пользователей и серверыДиагностика и поддержание в работоспособном состоянии вычислительной, печатающей техники и сетевого оборудования в филиалах и подразделениях предприятия в зоне ответственности отделаУстранение неисправностей в работе ПК, сетевого оборудования и программного обеспечения с использованием средств удаленного доступаЗамена расходных материалов и периодическое обслуживание вычислительной и оргтехникиАдминистрирование AD, DHCP, GPO, антивирусное ПОУправление серверамиВзаимодействие с руководителями филиалов и различными подразделениями предприятия для решения поставленных задачПроведение инвентаризации и подготовка документов по итогам инвентаризацийРазбор, обработка и маршрутизация обращений пользователей средствами ITILВедение учета оборудования в базе данныхКонсультирование сотрудников предприятия по выбору оборудования при закупочной деятельностиКонсультирование сотрудников предприятия по вопросам эксплуатации вычислительного и офисного оборудованияУчастие в развитии информационной структуры предприятия ",Полная занятость,От 3 до 6 лет,55000.0,50000.0,Специалист второй линии технической поддержки,2020-10-09T12:28:35+0300,"Требования: Средне специальное или Высшее образование – ПРОФИЛЬНОЕОпыт работы в технической поддержке от 3-х лет (системный администратор, ИТ-специалист/ специалист Helpdesk/Инженер)Знания линейки ОС Windows от XP, включая серверныеБазовые знания основных сервисов MS Windows Server: DNS, DHCP, MS Exchange, Active Directory, GPO, FTP, SMBЗнание основных сетевых протоколов и принципов построения ЛВСналичие навыков прокладки и ремонта СКСЗнание стандартных офисных приложений (MS Office 2010, 2013, 2016) и умение решать связанные с ними проблемыОпыт настройки и обслуживания периферийных устройств (принтеры, сканеры, МФУ, системы конференцсвязи)Хорошие коммуникативные навыки, желание помочь сотрудникам в решении возникающих проблем, готовность к интенсивной работе в команде, стремление обучаться новому и решать сложные задачиСоответствие требованиям общепринятой практики вежливости при деловом общении, в устной и письменной формах ",Полный день,"[{'name': 'Helpdesk'}, {'name': 'Active Directory'}, {'name': 'MS Exchange'}, {'name': 'DHCP'}, {'name': 'Windows Server 2003'}]","Условия: Оформление по ТК РФСоциальный пакетБесплатный проездКорпоративная сотовая связьЕжегодный оплачиваемый отпускГрафик работы 5/2 пн-чт. с 08:00 до 17:00, пт. с 08:00 до 15:45"
11328,11328,Москва,UNITED CARD SERVICES,Ищем Специалиста на 1 и 2 линию тех.поддержки пользователей. ,,Полная занятость,От 1 года до 3 лет,55000.0,50000.0,Специалист технической поддержки,2020-09-16T09:16:40+0300,,Сменный график,"[{'name': 'Настройка сетевых подключений'}, {'name': 'Настройка ПК'}, {'name': 'Настройка ПО'}, {'name': 'Офисная техника'}, {'name': 'windows'}]","Условия: Оформление с первого дня по ТК РФ, стабильная выплата з/п 2 раза в месяц на карту.Заработная плата 50.000 руб. (до вычета налогов) + годовая премия.График работы: 2 через 2 с 9:00 до 21:00.Наличие соц.пакета (мед. страховка, корпоративные мероприятия).Офис м. Академическая (10 мин.пешком)."
11726,11726,городской округ Домодедово,Московский аэропорт Домодедово,,"Обязанности: Проведение планово - предупредительных работ на оборудовании автоматизированной парковочной системы PM Abacus.Проведение ремонта оборудования стоек въезда/выезда, автоматических касс оплаты, автоматических шлагбаумов.Техническое обслуживание и ремонт камер распознавания гос. номеров автомобилей. Шеф - монтажные работы. Пусконаладочные работы. Ведение отчетной документации. ",Полная занятость,От 1 года до 3 лет,55000.0,50000.0,Специалист по обслуживанию парковочных систем,2020-10-14T16:40:03+0300,"Требования: Образование: средне-специальное или высшее техническое в области радиоэлектроники, телекоммуникации и связиЗнание теоретических основ электротехники,схемотехники и сетевых протоколов. Иметь навыки по ремонту радиоаппаратуры. Способность быстро усваивать техническую информацию. Опыт работы по профилю от 2-х лет.   ",Сменный график,[],"Условия: Работа в крупной стабильной компании;Заработная плата обсуждается по итогам собеседования;Регулярное обучение за счет компании;Реальные возможности профессионального развития и карьерного роста;Профессиональный и дружный коллектив;Насыщенная корпоративная жизнь: спортивные секции, корпоративные мероприятия, профильные конференции, круглые столы;Льготное кредитные программы от банков-партнеров;Собственные программы здравоохранения сотрудников;График работы сменный (день/ночь/2 выходных);Место работы &quot;Аэропорт Домодедово&quot;.  "
13435,13435,,Снежная Королева,,"Обязанности: Обеспечение своевременной и качественной поддержки пользователей КИС – сотрудников Компании и всех её обособленных подразделений.Обработка и решение заявок пользователей в системе HelpDesk в рамках утвержденных SLA.Решение проблем, возникающих у пользователей, связанных с эксплуатацией программного обеспечения (ERP-система, кассовая программа, и прочие ).Проведение консультаций сотрудников и руководителей по вопросам, связанным с эксплуатацией программного обеспечения, в рамках своей зоны ответственности.Поддержание в актуальном состоянии базы знаний, написание инструкций для пользователей. ",Полная занятость,От 1 года до 3 лет,55000.0,50000.0,Инженер по поддержке 1с (магазины),2020-10-08T16:58:48+0300,"Требования: Образование: высшее техническое.Дополнительная квалификация: поддержка 1С8.Опыт работы в аналогичной должности От 1 года.Навыки поддержки пользователей информационных систем 1C8.Перечень программ и уровень их владения: Опыт работы с программными продуктами ServiceDesk. 1C8, MS OfficeЛичностные качества: отличные коммуникативные навыки и работа в команде, аналитический склад ума, внимание к деталям, умение организованно и точно изъяснять мысли (как письменно, так и устно), умение быть максимально ориентированным на клиентов - пользователей компании, с учетом критичности и приоритетов задач. ",Полный день,"[{'name': 'Helpdesk'}, {'name': 'MS SQL'}, {'name': 'Работа в команде'}, {'name': 'Информационные технологии'}, {'name': 'MS Access'}]","Условия:  График работы (дни, часы): сменный, по 12 часов, варианты: 5-17, 9-21, 11-23 МСК, два дня через два. Работа на удаленке (Home office).  Рассматриваем кандидатов из любых городов  Стабильная заработная плата, выплачивается 2 раза в месяц на карту.  Интересные задачи. "
16518,16518,,ИНКОМ-НЕДВИЖИМОСТЬ,,,Полная занятость,Нет опыта,55000.0,50000.0,Менеджер по рекламе в Интернет,2020-10-09T17:54:13+0300,,Полный день,[],
17124,17124,,VEKA Rus,<u>,,Полная занятость,Нет опыта,55000.0,50000.0,Специалист технической поддержки пользователей/Младший системный администратор,2020-10-13T17:19:05+0300,,Полный день,"[{'name': 'Английский язык'}, {'name': 'Немецкий язык'}, {'name': 'Информационные технологии'}]","Условия работы: график работы 5х2 (суббота, воскресенье – выходные дни) 8-00 до 17-00ч "
4859,4859,Москва,Liqui Moly,,Обязанности: Прием и оформление заявок в программе 1С 8.3Формирование полного пакета документов для отправки грузаКонсультация клиентов и менеджеров по оперативным вопросамРабота с первичной документациейВедение базы данныхУрегулирование спорных вопросов с клиентами ,Полная занятость,От 1 года до 3 лет,56900.0,50000.0,Менеджер по работе с клиентами (Оператор 1С),2020-10-13T17:39:55+0300,"Требования: Опыт работы от 1 года в аналогичной должности в торговой компанииУверенный пользователь ПК, отличное знание программы 1С 8.3Опыт подготовки первичной документации по отгрузке товараГотовность работать с большим объемом информации (от 30 заказов в день)Коммуникабельность, внимательность, собранностьАккуратность, ответственность, стрессоустойчивость ",Полный день,[],
