,Unnamed: 0,city,company_name,description,duty,employment,experience,max_salary,min_salary,name,published_date,requirements,schedule,skills,terms
15794,15794,Тула,СервисКлауд,,"РАБОТА в г.ТУЛА.<br /><br />Обязанности: Внедрять и администрировать решения на базе ролей Windows Server: Active Directory, GPO, DNS, RDS, IIS, File, Hyper-V, Storage Spases;Внедрять и администрировать СУБД: Microsoft SQL сервер;Внедрять и администрировать решения на базе Microsoft Failover Cluster;Внедрять и администрировать серверные решения по резервному копированию;Подбирать необходимую конфигурацию оборудования под создаваемое решение;Проводить пуско-наладку новых серверов (получение, монтаж, установка ОС, подключение к мониторингу, автоматизация);Устранять и предотвращать инциденты;Диагностировать причины сбоев и отказов в работе аппаратного и программного обеспечения ;Проводить регламентные работы по обслуживанию информационных систем и сервисов;Внедрять, поддерживать и эксплуатировать системы он-лайн мониторинга доступности и производительности серверов, системы централизации логов; ",Полная занятость,От 3 до 6 лет,110000.0,80000.0,Windows инженер,2020-10-01T14:33:39+0300,"Требования: Знание типовых ролей Windows Server, области их применения и принципов их функционирования;Знание принципов построения корпоративных и высоконагруженных систем с применением продуктов Microsoft;Знание моделей обеспечения высокой доступности информационных систем;Знание принципов и способов организации резервного копирования, администрирование серверных решений по резервному копированию;Знание принципов построения и обслуживания реляционной БД;Знание рынка комплектующих серверного оборудования (платформы, диски, процессоры, память) и его характеристик, умение подобрать нужную конфигурацию под создаваемое решение;Знание методов измерения, мониторинга и контроля параметров функционирования и производительности аппаратного и программного обеспечения в рамках ИТ-инфраструктуры;Знание модели OSI, понимание работы протоколов канального, сетевого, транспортного и прикладного уровней;Умение планировать изменения; Желательно: Сертификаты, подтверждающие компетенции в области администрирования серверных операционных систем, сетевого оборудования, информационной безопасности, эксплуатации продуктов 1С. ",Полный день,"[{'name': 'Windows Os'}, {'name': 'Умение анализировать'}, {'name': 'Умение устранять инциденты'}, {'name': 'Знание модели OSI, понимание работы протоколов'}, {'name': 'Администрирование ролей Windows Server: Active Directory, GPO, DNS, RDS, IIS, File, Hyper-V, Storage'}, {'name': 'Знать принципы построения и обслуживания реляционной БД; Умение внедрять и администрировать СУБД: Mi'}]","Условия: Белая зарплата, прозрачный доход: оклад + kpi;Официальное трудоустройство, соц. пакет, гарантированный трудовым законодательством РФ;Полис ДМС для сотрудников компании после прохождения испытательного срока;Современный комфортный офис (чай/кофе, кофемашина, комната отдыха с кикером и пинг-понгом), собственная охраняемая парковка;Интересные корпоративные мероприятия;Изучение иностранных языков (английский, французский, немецкий) за счёт компании;График работы 5/2 с 9.00 до 18.00."
16884,16884,,Иванова Дарья Олеговна,,"Обязанности: Разрабатывать преимущественно бэкендРазвитие модулей проектовНаписание APIРазработка парсеров, компонентов ",Полная занятость,От 1 года до 3 лет,110000.0,80000.0,Программист Битрикс,2020-09-18T13:59:57+0300,"Требования: Сейчас нам требуется несколько разработчиков со знаниями Битрикс, желательно также знание фреймворков.Нужно понимать принципы SOLID, следовать стандартам. Нужно умение что-либо подверстать при необходимости. Умение работать самостоятельно, планировать рабочее время, ДУМАТЬ, адекватно оценивать работу и сроки.Желательно умение писать виджеты и компоненты.плюсом будет знание Docker, Elastic, RabbitMQ, Redis8-ми часовой рабочий день (быть на связи) ",Удаленная работа,"[{'name': 'Git'}, {'name': 'jQuery'}, {'name': 'JavaScript'}, {'name': 'MySQL'}, {'name': 'PHP'}, {'name': 'MVC'}, {'name': 'Linux'}, {'name': '1С-Битрикс'}]","Условия: Удаленная работа фулл-таймЗарплата на картуОсновное общение в Слак (нужно быть на связи)Работа в команде программистов. Используется система постановки задач, используется git"
17264,17264,,Агентство КИТ Консалт,,"Основные обязанности:   монтаж и настройка оборудования в офисе и у Заказчика (командировки 2-3 раза в месяц);обучение Заказчика работе на оборудовании и с программным обеспечением;ремонт оборудования, выезд к Заказчику по гарантийным случаям;сборка оборудования, работа на механическом участке;текущая техническая поддержка существующих клиентов;участие в демонстрации оборудования для клиентов;создание тестовых образцов и тестирование различных режимов работы оборудования;подготовка технической документации   ",Полная занятость,От 3 до 6 лет,110000.0,80000.0,"Сервисный инженер (промышленное оборудование, сепараторы, декантеры, центрифуги)",2020-09-22T13:51:10+0300,Требования: опыт работы от 5 лет в области обслуживания и ремонта промышленного оборудования;быстрая обучаемость;высшее инженерно-техническое образование;знание английского / немецкого языка (способность донести мысль; коллеги - немцы);коммуникабельность;способность анализировать и принимать решения;нацеленность на результат.   ,Полный день,[],"Условия: • Работа в крупной, стабильной компании Возможности карьерного и профессионального роста • График работы: с 8.00 до 17.00, 5/2, сб. и вс. -выходные • Оформление по ТК РФ, соц. пакет Белая заработная плата- оклад (от 80000 до 100000 рублей) - по результатам интервью, KPI • Комфортный современный офис в Химках (Вашутинское шоссе)    "
8258,8258,,Гарант,"Обязанности: - Разработка новых веб-сервисов компании. - Доработка и поддержка существующих решений. - Кросс-браузерная адаптивная вёрстка веб-компонентов. <br />Требования: - Высшее, неоконченное высшее (последний курс) образование по специальности информационные технологии. - Опыт работы в разработке. Хорошее знание HTML, CSS. Знание современных стандартов Javascript ES5+. - Умение работать с TACK-раннерами и системами сборки (Gulp, Webpack). - Владение системой контроля версий GIT. Опыт написания Unit-тестов. Способность разбираться и работать с чужим кодом. - Приветствуется наличие активного профиля на Github. <br />Условия: - График работы: полная занятость. Возможна как офисная, так и удаленная работа (с появлением в офисе 1-2 раза в месяц). - Офис в шаговой доступности от м. Ломоносовский проспект на территории МГУ им. Ломоносова. - Заработная плата: до 115000 руб. gross в месяц по результатам собеседования. - Соблюдение ТК РФ (оформление в штат, оплата отпусков и больничных листов).","Обязанности: - Разработка новых веб-сервисов компании. - Доработка и поддержка существующих решений. - Кросс-браузерная адаптивная вёрстка веб-компонентов. <br />Требования: - Высшее, неоконченное высшее (последний курс) образование по специальности информационные технологии. - Опыт работы в разработке. Хорошее знание HTML, CSS. Знание современных стандартов Javascript ES5+. - Умение работать с TACK-раннерами и системами сборки (Gulp, Webpack). - Владение системой контроля версий GIT. Опыт написания Unit-тестов. Способность разбираться и работать с чужим кодом. - Приветствуется наличие активного профиля на Github. <br />Условия: - График работы: полная занятость. Возможна как офисная, так и удаленная работа (с появлением в офисе 1-2 раза в месяц). - Офис в шаговой доступности от м. Ломоносовский проспект на территории МГУ им. Ломоносова. - Заработная плата: до 115000 руб. gross в месяц по результатам собеседования. - Соблюдение ТК РФ (оформление в штат, оплата отпусков и больничных листов).",Полная занятость,Нет опыта,115000.0,81000.0,Web-разработчик (Javascript),2020-10-15T09:13:05+0300,"Обязанности: - Разработка новых веб-сервисов компании. - Доработка и поддержка существующих решений. - Кросс-браузерная адаптивная вёрстка веб-компонентов. <br />Требования: - Высшее, неоконченное высшее (последний курс) образование по специальности информационные технологии. - Опыт работы в разработке. Хорошее знание HTML, CSS. Знание современных стандартов Javascript ES5+. - Умение работать с TACK-раннерами и системами сборки (Gulp, Webpack). - Владение системой контроля версий GIT. Опыт написания Unit-тестов. Способность разбираться и работать с чужим кодом. - Приветствуется наличие активного профиля на Github. <br />Условия: - График работы: полная занятость. Возможна как офисная, так и удаленная работа (с появлением в офисе 1-2 раза в месяц). - Офис в шаговой доступности от м. Ломоносовский проспект на территории МГУ им. Ломоносова. - Заработная плата: до 115000 руб. gross в месяц по результатам собеседования. - Соблюдение ТК РФ (оформление в штат, оплата отпусков и больничных листов).",Полный день,"[{'name': 'JavaScript'}, {'name': 'Git'}, {'name': 'CSS'}, {'name': 'HTML'}, {'name': 'CSS3'}]","Обязанности: - Разработка новых веб-сервисов компании. - Доработка и поддержка существующих решений. - Кросс-браузерная адаптивная вёрстка веб-компонентов. <br />Требования: - Высшее, неоконченное высшее (последний курс) образование по специальности информационные технологии. - Опыт работы в разработке. Хорошее знание HTML, CSS. Знание современных стандартов Javascript ES5+. - Умение работать с TACK-раннерами и системами сборки (Gulp, Webpack). - Владение системой контроля версий GIT. Опыт написания Unit-тестов. Способность разбираться и работать с чужим кодом. - Приветствуется наличие активного профиля на Github. <br />Условия: - График работы: полная занятость. Возможна как офисная, так и удаленная работа (с появлением в офисе 1-2 раза в месяц). - Офис в шаговой доступности от м. Ломоносовский проспект на территории МГУ им. Ломоносова. - Заработная плата: до 115000 руб. gross в месяц по результатам собеседования. - Соблюдение ТК РФ (оформление в штат, оплата отпусков и больничных листов)."
2055,2055,Москва,I Like IT,"Динамично развивающаяся ИТ-аутсорсинговая компания, ищет целеустремленного ИТ специалиста, для оказания качественного сервиса по ИТ поддержке нашим клиентов. Если Вам интересно развитие, получения обширных знаний в области ИТ технологий и карьерный рост внутри компании, добро пожаловать в нашу команду. ",Обязанности: ,Полная занятость,От 3 до 6 лет,110000.0,90000.0,Ведущий системный администратор / Руководитель группы технической поддержки (3 линия),2020-10-13T10:37:06+0300,"Требования:  Опыт работы системным администратором не менее 3-х лет.  Опыт управления персоналом.  Высокая самоорганизованность. Администрирование серверов Windows\Linux.Администрирование сетевой ИТ-инфраструктуры:Знания сетевого оборудования Mikrotik (обязательно).Опыт построения VPN для филиалов.Администрирование и настройка антивирусной защита KES, KSC, ESET.Поддержка и мониторинг IT-инфраструктур внутренних и внешних заказчиков. ",Полный день,[],"Условия: График работы пятидневная рабочая неделя;Время работы: с 9.00 до 18.00Оплата труда: От 90 000 до 110 000 на руки (определяется по результатам собеседования);Премиальная часть по результатам реализации проектов; Возможности профессионального развития, получения знаний и практического опыта в области современных ИТ технологий;Работа в команде профессиональных ИТ инженеров;Офис оснащен кондиционерами, кухней (чай, кофе, фрукты)."
12252,12252,Москва,ДСК АВТОБАН,,,Полная занятость,От 3 до 6 лет,110000.0,90000.0,Ведущий системный администратор,2020-10-05T12:20:28+0300,"В результате мы должны иметь:  <ol> <li>Бесперебойно работающие серверное, клиентское оборудование, программное обеспечение и информационные системы.</li> </ol> Показатели: <em>Суммарное время простоя в работе пользователей информационной системы за отчетный период по отношению к суммарному рабочему времени всех пользователей системы за тот же период, часы (обратный).</em><em>Среднее время удовлетворения заявки пользователя информационной системы, часы (обратный).</em> 2. Готовое рабочее место пользователя компании, соответствующее принятым в компании требованиям к аппаратному и программному обеспечению рабочих мест. Показатели: (<em>%) рабочих мест, полностью соответствующих принятым в компании требованиям к аппаратному и программному обеспечению рабочих мест, %.</em> 3. Задокументированные свойства и возможности аппаратного и программного обеспечения Показатели: <em>Отношение количества утвержденных документов, описывающих свойства аппаратных и программных компонентов информационной системы (вычисляется как сумма количества документов, свойств каждого компонента информационной системы по всем ее используемым или готовым к эксплуатации компонентам) к количеству документов, которые должны были быть утверждены за отчетный период, %.</em> ",Полный день,"[{'name': 'Hyper-V'}, {'name': 'Windows Server 2003'}, {'name': 'Ms Exchange Server'}, {'name': 'MS SQL'}, {'name': 'Строительство'}]",
13803,13803,Москва,Эйчар Консалт,,"Обязанности: Настройка телекоммуникационного оборудования ЛВС (на базе Extreme Networks) и СКС для инженерных систем здания (мультимедиа, видеонаблюдение, контроль доступа);Настройка сетевой части серверного оборудования, межсетевого экрана;Контроль работоспособности серверных ферм для инженерных систем здания (автоматизация, пожарная сигнализация, контроль доступа). ",Полная занятость,От 1 года до 3 лет,110000.0,90000.0,Инженер-наладчик ЛВС,2020-09-21T13:27:01+0300,"Требования: Глубокие знания сетевых технологий (уровень не ниже CCNA), наличие действующих сертификатов приветствуется;Опыт выполнения работ по настройке телекоммуникационного оборудования ЛВС;Уверенные знания принципов работы сети (TCP/IP, маршрутизация, vlan/vxlan, trunking, vpn), инструментов управления и диагностики;Опыт работы с оборудованием Cisco, Extreme, HPE;Инсталляция и базовое администрирование ОС Linux;Опыт по администрированию VMware, ESXi приветствуется. ",Полный день,"[{'name': 'Cisco'}, {'name': 'Администрирование сетевого оборудования'}, {'name': 'TCP/IP'}, {'name': 'Linux'}, {'name': 'Настройка сетевых подключений'}]","Условия: Оформление согласно ТК РФГрафик работы 5/2, с 8:30, переработки оплачиваются;Локация: м. Алексеевская, от метро 7 минут пешком."
