,Unnamed: 0,city,company_name,description,duty,employment,experience,max_salary,min_salary,name,published_date,requirements,schedule,skills,terms
10626,10626,,ТЛ Групп,"Traffic Light — международная маркетинговая платформа (CPA сеть), объединяющая в себе сотни интернет-рекламодателей и тысячи интернет-маркетологов (арбитражников). Мы ищем в команду специалиста по проверке благонадежности партнеров ( рекламодателей и вебмастеров). Вам предстоит поучаствовать в создании и поддержании системы безопасности, которая бы позволяла выявлять мошенников - клиентов на всех этапах работы с ними. Работа будет связана с многофакторным анализом IT информации.  ","Обязанности: <ol> <li> Проверка вновь зарегистрированных клиентов и принятие решений о дальнейшей работе с данными клиентами;  Оценка качества трафика от партнеров, на протяжении всей длительности работы партнера и принятие решения о продолжении сотрудничества. </li> </ol> ",Полная занятость,Нет опыта,60000.0,60000.0,"Аналитик / внутренний аудитор / специалист информационной безопасности, м. Пятницкое шоссе)",2020-10-15T16:00:55+0300,Требования: <ol> <li> Технические знания: <ol> <li> Уверенный пользователь интернета  Базовое понимание технологий интернета: <ol> <li> ip адрес  домены  браузер </li> </ol>  уверенный пользователь excel \ google sheets </li> </ol>  Личностные качества <ol> <li> Аналитический склад ума  Педантичность  Усидчивость  Желание быть “детективом”  Умение общаться с людьми (т.к. нужно будет звонить нашим партнёрам и нашим клиентам \ лидам) </li> </ol> </li> </ol> ,Полный день,"[{'name': 'MS PowerPoint'}, {'name': 'MS Internet Explorer'}, {'name': 'Работа с базами данных'}, {'name': 'MS Access'}, {'name': 'Поиск информации в интернет'}, {'name': 'ip адрес'}, {'name': 'домены'}, {'name': 'браузер'}]","Условия: Работа в офисе рядом с м. Пятницкое шоссе Стандартный рабочий день: 5 дней в неделю Гибкое начало и окончание рабочего дня Пицца, суши по пятницам Отличный руководитель и дружный коллектив Светлый, просторный офис рядом с лесным массивом    "
12128,12128,посёлок Вёшки,Мерида Плюс,,"Обязанности:  Помощь и консультирование пользователей при работе с ПО, Оргтехникой, ПК  Организация новых рабочих мест для пользователей  Контроль работы сервисов (физические сервера, виртуальные сервера, почтовый сервер, сервер телефонии, межсетевой экран, контроллеров домена, 1С, SQL, сервера терминалов, контроллера беспроводной сети в центральном офисе, системы мониторинга Zabbix, сетевого хранилища)   Создание учетных записей новых пользователей в доменной сети, создание почтового ящика на почтовом сервере, присвоение добавочного внутреннего номера на сервере телефонии  Контроль своевременного архивирования данных и при необходимости восстановление архивированной информации  Обеспечение бесперебойной работы рабочих станций, принтеров и телефонии в центральном офисе и в филиалах  Техническая и программная поддержка пользователей, консультирование пользователей в центральном офисе и филиалах  Техническая поддержка пользователей в системе Bitrix24, создание и изменение бизнес-процессов  Установка прав доступа и контроль за использованием сетевых ресурсов  Поддержание в актуальном состоянии имеющейся структуры локальной сети, документирование изменений  Организация сопровождения договоров с провайдерами  Приобретение нужных деталей, запчастей, приборов и оборудования  Организация вебинара для видеообучения филиалов   ",Полная занятость,От 1 года до 3 лет,60000.0,60000.0,Специалист технической поддержки (метро Алтуфьево),2020-10-02T12:00:36+0300,"Требования:  Знание операционных систем семейства Microsoft Windows от 7 до 10  Желателен опыт работы с серверными операционными системами Microsoft   Желателен опыт администрирования Hyper-V, Failover Cluster, Exchange 2010, AD, DNS, RDSH, Asterisk (freepbx), SQL Server 2012  Знание основ сетевых проколов  Опыт работы с Linux, Bitrix 24 приветствуется, опыт настройки систем мониторинга Zabbix 5.0 приветствуется  Английский язык на уровне чтения и понимания технической литературы  ",Полный день,"[{'name': 'Hyper-V'}, {'name': 'Ms Exchange Server'}, {'name': 'Администрирование серверов Windows'}, {'name': 'Настройка DNS'}, {'name': 'Поддержка пользователей'}, {'name': 'Коммуникабельность'}]","Условия: Оформление по ТК РФ, оплата больничного, отпуска Оплата мобильной связи  Корпоративный транспорт от м. Алтуфьево в утренние и вечерние часы (7-10 мин. в пути)  Охраняемая парковка для вашего автомобиля, оплачивает компания  График работы - с 9:00 до 17:30 или с 9:30 до 18:00, пятидневка  Офис в современном бизнес-центре класса А (БЦ &quot;Вёшки Парк&quot;)  Возможность карьерного роста и профессионального развития в стабильной европейской компании  Компетентный и дружелюбный коллектив, чаи/кофе, корпоративные мероприятия "
13730,13730,Москва,ФОРЭНЕРГО-ТРЕЙД,,"Обязанности: Поддержка работы локальной сети, компьютерного оборудования и оргтехникиМонтажные работы (прокладка ЛВС, телефонных линий, электрических линий)Мелкий ремонт оргтехникиПоддержка и обучение пользователей ",Полная занятость,От 1 года до 3 лет,60000.0,60000.0,Системный администратор-инженер,2020-09-18T17:27:10+0300,"Требования: Опыт от 3 лет по обязанностям при количестве техники от 20 ед.Знание ОС Windows, сетевое администрирование на профессиональном уровнеНавыки диагностики, обслуживания и ремонта комп и оргтехникиЖелание повышать свой профессиональный уровень и самообучатьсяВозможность ненормированного рабочего дня ",Полный день,"[{'name': 'Прокладка кабелей'}, {'name': 'Windows 7'}, {'name': 'Windows Vista'}, {'name': 'MS Dos'}]","Условия: Офис порядка 90 человек, Перово5/2, 9-18, ЗП белаяПриветствуем долгосрочное сотрудничествоИспытательный срок 60 грязными, потом 60 чистыми"
14113,14113,,Human Links,,"Обязанности: Диагностика сетейАппаратного обеспеченияАнализировать ошибки ПО и уметь быстро восстанавливать работоспособность АПКНастройка и сопровождение систем клиент-банк и бухгалтерской отчетности (СБИС, такском) ",Полная занятость,От 1 года до 3 лет,60000.0,60000.0,Специалист по технической поддержке,2020-10-05T10:08:12+0300,"Требования:  Семейство MS Windows на уровне администрирования  MS Office опытный пользователь  Kaspersky умение настраивать Знание сетей TCP-IP, активного и пассивного сетевого оборудования, умение диагностировать и устранять неисправности в сети.Умение настраивать ПО удаленного доступаЗнание аппаратной части ПК на уровне диагностики и ремонта ",Полный день,"[{'name': 'Настройка сетевых подключений'}, {'name': 'TCP/IP'}, {'name': 'Настройка ПК'}, {'name': 'Windows 7'}, {'name': 'Администрирование сетевого оборудования'}]","Условия: График 5/2Оформление по ТКОфис м. Чеховская, Тверская, Пушкинская"
14859,14859,Москва,РДЛ-Телеком,,"Обязанности: Комплексная диагностика и обработка поступающих обращений;Ведение мониторинга за основными узлами сетевой инфраструктуры на объектах Заказчика;Создание/решение/маршрутизация инцидентов для каждого обращения в соответствии с принятыми алгоритмами, правилами, нормами и KPI;Координирование технических специалистов при решении проблем;Взаимодействие с внешними компаниями-партнёрами операторами связи при устранении инцидента;Документирование всех действий производимых при обработке обращения: сути обращения, выводов и результатов отработки инцидента в ИС компании;Составление ежедневной отчетности по поступившим обращениям;Обнаружение и инициация массовых инцидентов по вверенным на поддержку услугам в соответствии с принятыми алгоритмами, правилами, нормами и KPI. ",Полная занятость,От 1 года до 3 лет,60000.0,60000.0,Инженер службы технической поддержки/Диспетчер,2020-10-14T19:19:19+0300,"Требования: Опыт работы системой мониторинга Битрикс 24;Знание основ работы сетей Ethernet и Wi-Fi, DHCP. DNS, модели OSIЗнание командной строки Linux;Составления плановых и оперативный отчетов;Грамотный разговорный русский язык;Максимальный уровень ответственности и самоорганизации(основная компетенция);Умение работать с большими объемами информации в режиме многозадачности;Опыт работы в РЖД и ФПК приветствуется;Обучаемость; ",Сменный график,"[{'name': 'Ведение отчетности'}, {'name': 'Работа с большим объемом информации'}, {'name': 'Точность и внимательность к деталям'}]","Условия: Оформление по трудовому законодательству, как основная работа;График работы 2/2 рабочее время в 8:00 до 20:00Оклад 50 000 рубВозможен карьерный рост;Белая заработная плата;Офис - м. Авиамоторная;Работа на территории работодателя  "
14901,14901,Москва,ТКО-ИНФОРМ,Компания ТКО Информ является системным интегратором и разработчиком платформы для автоматизации работы региональных операторов отвечающих за вывоз и переработку отходов. Вакансия подразумевает обработку письменных и устных входящих обращений от компаний являющихся нашими клиентами. Мы готовы рассмотреть кандидатов с опытом техподдержки в любой сфере. ,"Обязанности: Проведение первичной классификации и приоритизации заявок, поступивших от пользователей по разным каналам связи.Обработка заявок от пользователей, поступающих в системе Service Desk и e-mail.Консультирование клиентов в режиме &quot;онлайн&quot; (мессенджеры, исходящие звонки).Эскалация проблем на следующий уровень поддержки по результатам анализа задачи.Контроль решения обращений пользователей.Согласование с Заказчиками закрытия запросов пользователейУчастие в подготовке инструкций и информационных материалов для пользователей. ",Полная занятость,От 1 года до 3 лет,60000.0,60000.0,Специалист технической поддержки,2020-09-29T13:59:38+0300,Требования: Опыт работы с Клиентами;Опыт работы в службе технической поддержке (1-2 линия) будет преимуществом;Умение работать с обращениями пользователей;Умение анализировать и выявлять источник проблемы. ,Полный день,"[{'name': 'Информационные технологии'}, {'name': 'входящие звонки'}, {'name': 'Техническая поддержка'}, {'name': 'Анализ данных'}, {'name': 'Грамотная речь'}]","Условия: Полностью белая компания, заработная плата 60 т.р. на руки после испытательного срока, 50 т.р. на испытательный срок. График работы день/ночь, отсыпной выходной, на испытательный срок возможен график понедельник - пятница 10.00 - 19.00.  "
15172,15172,,ЦентрПроф,"Монтажник слаботочных систем в проектно-монтажную компанию Зарплата 60 000 руб (на руки) График работы: пятидневная рабочая неделя, раб день 8 час Обучение по оборудованию, которое используется в проекте - в процессе работы Возможность профессионального и карьерного роста! ОБЯЗАННОСТИ: Монтаж систем видеонаблюдения; Прокладка кабелей; Установка и настройка оборудования - ознакомление с оборудованием происходит в процессе работы ТРЕБОВАНИЯ: Опыт в монтаже слаботочных систем Физически крепкие люди для работы на объектах строительства.",,Полная занятость,От 1 года до 3 лет,61000.0,60000.0,Монтажник слаботочных систем,2020-09-21T11:29:31+0300,,Полный день,"[{'name': 'Монтаж оборудования'}, {'name': 'Монтаж инженерных систем'}, {'name': 'Прокладка кабелей'}, {'name': 'Производство строительно-монтажных работ'}]",
4925,4925,Москва,НИИТФА,,"Обязанности: участие в экспертизе проектов локальных нормативных актов, организационно-распорядительных документов, регламентирующих вопросы защиты информации;формирование требований к системе защиты информации и ИТ-инфраструктуре объектов в части информационной безопасности;контроль за эффективностью информационной безопасности;внедрении и настройка средств защиты информации;разработка моделей угроз и нарушителей;организация мероприятий по защите информации для рабочих мест, на которых проводятся работы с использованием сведений, составляющих государственную тайну;выполнение соблюдения требований по технической защите информации при подключении к централизованным информационным ресурсам Госкорпорации «Росатом»;подготовка отчетных документов о результатах работы;проведение комплексных и тематических проверок;участие в проведении служебных расследований по выявлению (пресечению, устранению) фактов утечки по техническим каналам сведений, составляющих государственную тайну ",Полная занятость,От 3 до 6 лет,65000.0,60000.0,Специалист по информационной безопасности,2020-10-15T11:44:01+0300,"Требования: наличие компетенций в составлении и согласовании организационно-распорядительных документов и проектной документации;знание нормативных требований Федерального законодательства и регуляторов в области защиты информации (ФЗ № 98, ФЗ №149, ФЗ №152, ФЗ №187, ФЗ №63, ПП 119, ПП 1233, Приказ ФСТЭК № 17,21, Приказ ФСБ №378, Приказ ФАПСИ №152);понимание принципов создания систем защиты информации;наличие опыта разработки ОРД, эксплуатационной документации;высшее образование;релевантный опыт работы от трех лет;знание следующих систем: - Система защиты информации от несанкционированного доступа(СЗИ НСД); - Система управления базами данных; - Операционные системы; - Система антивирусной защиты (CАВЗ); - Система межсетевого экранирования (МCЭ); - Система обнаружения и/или предотвращения вторжений (СОВ); - Система анализа защищенности (АНЗ); - Система мониторинга событий ИБ (SIEM-система); - Система управления доступом (УПД); - Система защиты от утечек конфиденциальной информации (DLP-система); - Система защиты среды виртуализации (ЗСВ); - СКЗИ. ",Полный день,"[{'name': 'Информационная безопасность'}, {'name': 'Технические средства информационной защиты'}, {'name': 'Средства криптографической защиты информации'}, {'name': 'Информационные технологии'}, {'name': 'Аудит безопасности'}]","Условия: график работы 5/2, 9:00-17:30;ДМС (включая стоматологию) после прохождения испытательного срока;участие в отраслевых программах корпоративного развития;оформление согласно ТК РФ с первого дня, официальные выплаты без задержек;работа в стабильной компании (контур Госкорпорация &quot;Росатом);дружный коллектив.  "
