,Unnamed: 0,city,company_name,description,duty,employment,experience,max_salary,min_salary,name,published_date,requirements,schedule,skills,terms
1427,1427,,Компания 3soft,Компании ,"Обязанности: Первичное выяснение потребностей сотрудников клиента и составление первичного ТЗ (черновика) для последующей проработки его в паре с аналитиком.Разработка расширений, внешних отчетов, обработок для 1C:ERP, 1С:Управление торговлей 11, 1С:Бухгалтерия 3, 1С:Управление торговлей 10, 1С:Розница 2, обменов между ними на 1С:Конвертация данных 2, а также улучшение наших тиражных продуктов (3soft:WMS, 3soft:CRM) - несколько из данного перечня, в зависимости от того, какие направления для нового коллеги будут интересны.Взаимодействие с сотрудниками клиентов для устранения проблем в своем коде (или по уважительной причине - в коде коллег).Обязательное отражение своей работы в системе учета задач (регистрация новых задач, поступивших через Вас, удобная фиксация затраченного времени) и системах контроля версий (коммиты с Вашими изменениями).Участие в онлайн-совещаниях (в основном - внутренних, редко - с сотрудниками клиентов), иногда с видео. ",Полная занятость,От 1 года до 3 лет,110000.0,80000.0,Программист 1С,2020-10-15T06:06:44+0300,"Требования: Хорошее владение навыками алгоритмизации (если Вы без блок-схемы можете в уме спроектировать средней сложности алгоритм - это большой плюс).Желательно умение &quot;читать&quot; код 1С: без отладки, без конструктора запросов, без комментариев понимать, о чем он.Опыт программирования на ",Удаленная работа,"[{'name': 'язык запросов 1с'}, {'name': 'встроенный язык 1с'}]","устного общения с постановщиками задачи - не программистами.Желателен опыт разработки в сфере подключаемого оборудования (2D-сканеры, ТСД, ККТ-онлайн) - в условиях всеобщей маркировки это актуально.Владение (или желание овладеть) на базовом уровне одним из следующих языков или инструментов: Git, OScript, web-севрисы, Bash, Vanessa-Automation, CI/CD, Ruby on Rails, Python, English.  "
5082,5082,Москва,Раш Эдженси,"В данный момент в команду требуется опытный Middle Full Stack разработчик, задачей которого, будет разработка и поддержка сайтов для клиентов компании!<br />Ссылка на Git c примерами твоего кода, чтобы мы смогли подготовиться ко встрече<br />крайне приветствуется! <br />",,Полная занятость,От 1 года до 3 лет,110000.0,80000.0,PHP- Middle Full Stack Developer,2020-10-14T18:47:24+0300,,Полный день,"[{'name': 'jQuery'}, {'name': 'JavaScript'}, {'name': 'Bootstrap'}, {'name': 'Git'}, {'name': 'MySQL'}]",
5921,5921,,Тоскана,"Bestceramic.ru - интернет-магазин отделочных материалов.<br />Постоянно развиваем 1с. Ищем 1с-программиста на удаленные проекты (разработка нового функционала и доработка существующего). Работа удаленная, полный рабочий день (full-time). От вас ждем отличное знание 1с Конфигурация &quot;Управление торговлей&quot;, редакция 10.3 (типовая, много доработок), поэтому важно уметь разобраться с текущим кодом (программист-разработчик на связи). Желание изучать что-то новое для выполнения поставленной задачи. ","Обязанности: Разработка,тестирование и сдача в релиз нового функционала в системе по заданию;Доработка бизнес-процессов;Администрирование конфигурации;Настройка телефонии &quot;Простые звонки&quot;.   ",Полная занятость,От 3 до 6 лет,110000.0,80000.0,Программист 1с (удаленно),2020-10-14T09:17:40+0300,"Требования: Опыт в программировании на 1С:Предприятие 8.3 от 3-ех лет. Отправляйте успешно реализованные проекты в сопроводительном письме;Отличное знание встроенного языка и технологической платформы 1С:Предприятие 8.3, наличие опыта разработки нового функционала на платформе 1С:Предприятие;Умение пользоваться механизмами разработчика (консоль запросов и пр.);Наличие сертификатов 1С будет плюсом.   ",Удаленная работа,"[{'name': 'Администрирование'}, {'name': '1С программирование'}, {'name': '1С-Битрикс'}, {'name': '1С: Управление Торговлей'}, {'name': 'Обновление конфигурации 1С'}, {'name': '1С: Предприятие 8'}]","Условия: Работа удаленная, но нужно быть онлайн на связи в течение рабочего дня. Программиста ищем на полный рабочий день, full-time.В качестве таск-трекера используем Б24;Удаленные планерки;За чистый, быстрый код и высокую эффективность — премии/повышение оклада.Работа в команде со вторым разработчиком и проджект менеджером;Для начала работы необходимо выполнить тестовое задание.  "
6017,6017,Москва,Аксилон Консалтинг,Ищем в команду разработчика React с опытом коммерческой разработки. ,,Полная занятость,От 1 года до 3 лет,110000.0,80000.0,Frontend-разработчик React,2020-10-13T00:59:36+0300,,Полный день,"[{'name': 'JavaScript'}, {'name': 'jQuery'}, {'name': 'CSS3'}, {'name': 'React'}, {'name': 'Python'}, {'name': 'Websocket'}]","Условия: Оформление по ТКОфис м. Шоссе Энтузиастов, 5 мин пешкомФормат дистанционной работы – обсуждаемо индивидуальноГибкий график – возможениспытательный срок до 3 месяцев  "
7996,7996,,Oxem Studio,"Привет! В веб-студии Oxem мы с 2014 года занимаемся разработкой сайтов и веб-сервисов. Сейчас мы ищем в команду веб-разработчика с уверенными знаниями 1С-Битрикс, который хочет решать сложные и интересные задачи. В своих проектах мы реализуем нестандартную для Битрикса логику работы каталога товаров и обработки заказов, разнообразные интеграции с внешними сервисами. Подобные задачи позволяют постоянно прокачивать свои навыки и находить интересные решения. Программист, который проработал с нами год, способен разобраться с любым кодом и выполнить практически любую задачу. Мы ведем документацию по проектам и постоянно пополняем внутреннюю базу знаний свежими кейсами и наработками. Ценим в каждом нашем сотруднике желание расти и развиваться в любимом деле, ответственность и честность. Стремясь сделать клиентов лидерами в их нишах, мы уделяем большое внимание качеству создаваемых проектов, начиная от безупречно проработанных дизайна и вёрстки, заканчивая грамотной интеграцией функционала средствами CMS и фреймворков. В работе стремимся минимизировать рутину, автоматизируя процессы современными инструментами, такими как Docker, Deployer, GitLab CI. Каждая строчка кода проходит ревью со стороны старших разработчиков, прежде чем оказаться на боевой копии сайта. Мы наращиваем техническую команду и готовы предложить интересную работу, новые проекты, достойную заработную плату и гибкие условия рабочего дня. ",,Полная занятость,От 1 года до 3 лет,110000.0,80000.0,Веб-разработчик PHP (1С-Битрикс) / PHP-developer (удаленно),2020-10-13T12:26:59+0300,"Требования:  Хорошие знания 1С-Битрикс, на уровне ядра, написания/модификации компонентов, шаблонов и модулей, знание D7.  Опыт работы с интернет-магазинами на 1С-Битрикс.  Знание принципов ООП и следование им.  Умение работать с логами, дебажить, находить и исправлять ошибки в коде. Знание JS на уровне, достаточном для написания с нуля фронтовой части к своим компонентам.Опытный пользователь Linux (LAMP/LEMP), опыт взаимодействия с SSH консолью (бэкапы, кроны, права на файлы и т.д.). Опыт работы с GIT (используем GitLab).  Умение трезво оценивать сроки и давать обратную связь в процессе.  Ответственность, самостоятельность и проактивность, высокая скорость работы.  ",Полный день,"[{'name': 'CSS'}, {'name': 'Администрирование серверов Linux'}, {'name': 'Веб-программирование'}, {'name': 'HTML'}, {'name': 'CSS3'}, {'name': 'ООП'}, {'name': 'jQuery'}, {'name': 'Git'}, {'name': 'Linux'}, {'name': 'JavaScript'}, {'name': 'MySQL'}, {'name': 'HTML5'}, {'name': 'PHP'}, {'name': 'Разработка ПО'}, {'name': 'Ajax'}, {'name': 'Nginx'}, {'name': '1С-Битрикс'}]","Привет! В веб-студии Oxem мы с 2014 года занимаемся разработкой сайтов и веб-сервисов. Сейчас мы ищем в команду веб-разработчика с уверенными знаниями 1С-Битрикс, который хочет решать сложные и интересные задачи. В своих проектах мы реализуем нестандартную для Битрикса логику работы каталога товаров и обработки заказов, разнообразные интеграции с внешними сервисами. Подобные задачи позволяют постоянно прокачивать свои навыки и находить интересные решения. Программист, который проработал с нами год, способен разобраться с любым кодом и выполнить практически любую задачу. Мы ведем документацию по проектам и постоянно пополняем внутреннюю базу знаний свежими кейсами и наработками. Ценим в каждом нашем сотруднике желание расти и развиваться в любимом деле, ответственность и честность. Стремясь сделать клиентов лидерами в их нишах, мы уделяем большое внимание качеству создаваемых проектов, начиная от безупречно проработанных дизайна и вёрстки, заканчивая грамотной интеграцией функционала средствами CMS и фреймворков. В работе стремимся минимизировать рутину, автоматизируя процессы современными инструментами, такими как Docker, Deployer, GitLab CI. Каждая строчка кода проходит ревью со стороны старших разработчиков, прежде чем оказаться на боевой копии сайта. Мы наращиваем техническую команду и готовы предложить интересную работу, новые проекты, достойную заработную плату и гибкие условия рабочего дня. "
9067,9067,,АТЭК,,"Обязанности: --- Инсталляция и настройка системного программного обеспечения; --- Осуществление конфигураций ПО на рабочих станциях; Проведение тестирования и мелкого ремонта отдельных устройств и средств вычислительной техники;Замена расходных материалов принтеров и копировальной техники;Организация ремонта средств вычислительной техники с привлечением специализированных учреждений;Участие в разработке инструкций ,методических и нормативных материалов по использованию и эксплуатации информационной системы;Поддержка сервиса печати, телефонии(IP-телефония -Ericsson, Aastra, Asterics, Avaya);Обеспечение бесперебойного функционирования оборудования ИС и принятия оперативных мер по устранению возникающих в работе нарушений;Качественное и своевременное выполнение иных задач, поставленных непосредственным и вышестоящим руководством;   ",Полная занятость,От 1 года до 3 лет,110000.0,80000.0,Инженер по информационным технологиям,2020-10-13T09:29:34+0300,"Требования: Высшее техническое образование;Навыки работы с продуктами ИБ(сканеры уязвимости, и.т.д.);Понимание принципов устройства и работы современных ИТ-инфраструктур ,ОС,серверного и сетевого оборудования;Знание SQL и работа с БД (будет являться преимуществом);Знание Linux(CentOS,SLES);Опыт работы с серверами HPE;Технический английский язык;Стрессоустойчивость; ",Полный день,[],Условия: Официальное оформление по ТК РФ с первого дня работы в компании;Стандартный график работы(5/2)Выплаты заработной платы 2 раза в месяц;Уютный офис и дружный коллектив;Официальное трудоустройство согласно ТК РФ;
9586,9586,Москва,ФГБУ ФКП Росреестра,,"Обязанности: Администрирование систем виртуализации VMware vSphere;Обеспечение эксплуатации и непрерывности функционирования виртуальной инфраструктуры;Контроль доступных мощностей;Мониторинг работы инфраструктуры виртуализации и анализ её производительности, поиск узких мест, устранение неисправностей. ",Полная занятость,От 1 года до 3 лет,110000.0,80000.0,Специалист по технической поддержке_(ОАЭППО),2020-09-28T16:57:18+0300,"Требования: Знание виртуализации VMware на уровне VCP;Знание сети на уровне CCNA;Опыт разработки (автоматизации администрирования) на любом языке программирования;Уверенное администрирование Windows и Linux систем;Опыт администрирования СХД, СРК и SAN;Как преимущество - уверенное владение продуктами и знание технологий VMware – vSphere\vCloud;Знание серверных платформ x86 различных производителей (IBM, Lenovo, Huawei, HP) включая блэйд и модульные сервера. ",Полный день,"[{'name': 'VMware'}, {'name': 'Linux'}, {'name': 'Turbo Pascal'}, {'name': 'Pascal'}, {'name': 'Планирование карьеры'}, {'name': 'Администрирование серверов Linux'}, {'name': 'Администрирование серверов Windows'}, {'name': 'Администрирование СХД'}, {'name': 'Администрирование СРК'}, {'name': 'Администрирование SAN'}]",Условия: Официальное трудоустройство;График 5/2 (с 9:00 до 18:00);Возможность карьерного роста;Испытательный срок 3 месяца.
12872,12872,,МЦ-Сервис Инжиниринг,<em>,,Полная занятость,От 1 года до 3 лет,110000.0,80000.0,Специалист технической поддержки в компанию разработки ПО,2020-10-14T15:34:38+0300,Рассматриваем кандидатов соответствующих требованиям: Опыт работы в службе поддержки пользователей;,Удаленная работа,[],"В свою очередь компания не останется в долгу и готова предложить: Высокую, стабильную зарплату (условия обсудим на собеседовании)ДМС на территории г. Москва (после прохождения испытательного срока)Возможность карьерного роста (внедрение \ аналитик)Дружный и отзывчивый коллектив.   <em>"
14227,14227,Москва,MALLTECH,,"Обязанности: — Разработка дизайна для страниц веб-сайтов, экранов навигационных панелей, кинотеатра, маркетплейса, посадочных страниц маркетинговых акций и прочего digital-инвентаря — Адаптация и дизайн маркетинговых баннеров, электронных писем — Подготовка изображений, новостей, акций, статей к размещению на сайтах — Работа с анимацией и созданием интерактивных баннеров, UX/UI дизайн — Участие в других проекта digital – проектах согласно своему функционалу ",Полная занятость,От 3 до 6 лет,110000.0,80000.0,Web-дизайнер,2020-10-14T14:23:06+0300,"Требования: — Опыт работы от 3х лет- обязателен! — Знание основ web–дизайна, графических редакторов Figma, Adobe Photoshop/Illustrator/After Effects, программ и сервисов Readymag, Invision, Power Point, Tilda — Знание основ HTML/CSS, основ верстки веб-сайтов, электронных писем — Хороший вкус и креативное мышление — Наличие портфолио - обязательно!! ",Полный день,"[{'name': 'Adobe Photoshop'}, {'name': 'Adobe Illustrator'}, {'name': 'CSS'}, {'name': 'Web-дизайн'}, {'name': 'Веб-дизайн'}, {'name': 'Web Design'}]","Условия: — Полная занятость 5/2; работа в офисе в БЦ Московский Шёлк (м. Спортивная, м. Киевская) — Белая зп, ДМС"
