,Unnamed: 0,city,company_name,description,duty,employment,experience,max_salary,min_salary,name,published_date,requirements,schedule,skills,terms
9266,9266,Москва,Иммунологическая лаборатория АБТ,,"Обязанности: Организация и поддержка сетевой инфраструктуры;Настройка серверного и сетевого оборудования;Обеспечение бесперебойного функционирования всех IT - процессов компании;Взаимодействие с внешними провайдерами услуг;Организация и поддержка работы удаленных сотрудников;Приобретение и настройка ПК, установка антивирусного ПО;Техническая поддержка пользователей. ",Частичная занятость,От 3 до 6 лет,50000.0,40000.0,ИТ специалист в медицинскую лабораторию,2020-10-07T07:13:38+0300,"Требования: Опыт работы в сфере системного администрирования (от 3-х лет);Целеустремленность и умение доводить начатое до конца;Готовность быть на связи 7 дней в неделю с 8 утра до 22-23 часов (лаборатория работает с 8 до 20 без выходных, некоторые сотрудники работают из дома по вечерам), в случае проблем приехать в выходной день$английский язык на уровне чтения и понимания технической информации (в лаборатории стоит иностранное оборудование, периодически приезжают иностранные специалисты для его инсталляции и интеграции с ПК и ПО) ",Гибкий график,"[{'name': 'Администрирование серверов Windows'}, {'name': 'Администрирование серверов Linux'}, {'name': 'MS SQL'}, {'name': 'Серверы RDP'}, {'name': 'NAS-серверы'}, {'name': 'Web-серверы Nginx, IIS'}, {'name': 'Гипервизор ESXi'}, {'name': 'Настройка почтовых серверов'}, {'name': 'Администрирование сетевого оборудования'}, {'name': 'TCP/IP'}, {'name': 'Настройка сетевых подключений'}, {'name': 'Техническая поддержка'}, {'name': 'Настройка ПК'}, {'name': 'Системное администрирование'}]","Условия: Заработная плата 40-50 т.р. после вычета налогов;Работа без постоянного присутствия на рабочем месте, с приездом по необходимости."
9722,9722,,WAZZUP,IT-стартап Wazzup приглашает в команду ,,Полная занятость,От 1 года до 3 лет,50000.0,40000.0,UX/UI Дизайнер,2020-10-15T11:34:22+0300,"Что предстоит делать: Разбираться в требованиях и логике работы функционала;Прорабатывать сценарии пользовательских взаимодействий;Проектировать и дизайнить интерфейсы (веб-приложения, сайты);Создавать адаптивный дизайн;Оформлять и поддерживать UI-kit;Взаимодействовать с командой разработчиков, контролировать реализацию дизайна;Создавать графический дизайн отдельных элементов: инфографика, виджеты, и др (рисовать с 0 иконки и иллюстрации не нужно). ",Удаленная работа,"[{'name': 'Adobe Photoshop'}, {'name': 'Adobe Illustrator'}, {'name': 'UX'}, {'name': 'UI'}, {'name': 'Дизайн интерфейсов'}, {'name': 'Figma'}]","Условия: 5/2, с 9 до 18, удалёнка;ЗП на старте 40-50 тыс, в зависимости от выполнения тестового задания (а оно будет);Испытательный срок - 1 месяц, оклад на испытательный срок 35 тыс;Оплачиваемый отпуск, трудоустройство;Возможность внести лепту в завоевание мира. "
10237,10237,,Туризм Охота Рыбалка,,"Обязанности: наполнение сайта информацией о товарах;контроль актуальности содержимого сайта;обработка заказов (телефон, почта, сайт);организация доставки/выдачи заказа;консультирование клиентов по товарному ассортименту;проверка наличия остатков товаров у поставщиков;взаимодействие с поставщиками;оформление документации;коммуникации со специалистами по SEO продвижению; ",Полная занятость,От 1 года до 3 лет,50000.0,40000.0,Менеджер интернет-магазина,2020-10-13T09:50:12+0300,"Требования: высшее образование;опыт работы от 1 года по наполнению сайтов;компетенции в рыбалке или охоте;знание ассортимента товаров для рыбалки и охоты;хорошее знание русского языка;умение хорошо писать;уверенный пользователь ПК Excel, Word, Adobe Photoshop; ",Полный день,"[{'name': 'Adobe Photoshop'}, {'name': 'Продвижение сайтов'}, {'name': 'Закупка товаров и услуг'}, {'name': 'Поиск информации в интернет'}, {'name': 'Консультирование клиентов по телефону'}]","Условия: трудоустройство в соответствии с ТК РФ;график работы с 10-00 до 19-00, сб, вс - выходные;заработная плата 2 раза в месяц без задержек;комфортное место работы по адресу: Дмитровское шоссе, д.157 (БЦ Гефест)."
10431,10431,,"Принтград, ГК",Компания ПРИНТГРАД. Работаем с 2005 года.Занимаемся поддержкой ИТ-инфраструктуры. Ищем техника для проведения профилактических работ на ИТ-оборудовании: ,"Обязанности:  Выполнение сценариев обслуживания оборудования (обновления системных журналов, удаление временных объектов, оптимизация, наведение порядка, очистка от пыли)  Предоставление отчетности о проделанной работе  ",Полная занятость,Нет опыта,50000.0,40000.0,Техник по оборудованию ИТ,2020-09-29T14:37:54+0300,"Требования:  Опыт настройки ПК, подключения оргтехники будет преимуществом  Готовность к разъездному характеру работы  ",Полный день,"[{'name': 'Разъездная работа'}, {'name': 'Профилактика'}, {'name': 'Техническое обслуживание'}]","Условия:  Доход от 40.000 руб./мес. Структура дохода обсуждается на собеседовании, зависит от квалификации  Официальное трудоустройство и белая заработная плата  Компенсация ГСМ по топливной карте, оплата амортизации  Работа в &quot;домашнем&quot; регионе  Корпоративная сотовая связь  График работы 5/2 с 9.00 до 18.00  Карьерный и профессиональный рост "
11423,11423,,Staff-UP Consulting Group,"Мы реализуем IT-проекты и автоматизируем бизнес-процессы для коммерческих компаний различных отраслей, в том числе для крупных веб-студий, стартапов, IT-компаний и государственных структур. На сегодняшний день мы входим в ТОП-15 аутсорс-продакшенов России по версии Tagline, в ТОП-30 лучших компаний рейтинга Ruward. Приглашаем Вас стать частью нашей дружной команды! ","Обязанности: Осуществлять ручное приемочное тестирование продуктов, модулей, платформ и пр.(если есть желание, то можно построить автоматизированный процесс;<br />Документировать результаты тестирования;<br />Писать тест-кейсы;<br />Оценивать трудозатраты на тестирование;<br />Выявлять причины, регистрировать и «закрывать» обнаруженные ошибки;<br />Активно коммуницировать с командами разработки и поддержки. ",Полная занятость,От 1 года до 3 лет,50000.0,40000.0,Тестировщик,2020-10-02T16:15:03+0300,Требования: Опыт работы с Jira или другим баг-трекером;<br />Желательны навыки проведения ручного тестирования и формирования баг- репортов;<br />Знание инструментов проведения тест-анализа и подготовки сценариев тестирования;<br />Знание процесса разработки программного обеспечения и минимальный опыт программирования;<br />Знание HTML и CSS;<br />Навыки сбора и обработки информации;<br />Навыки подготовки аналитической отчетности;<br />Грамотная письменная и устная речь; ,Удаленная работа,"[{'name': 'Atlassian Jira'}, {'name': 'CSS'}, {'name': 'HTML'}, {'name': 'Test case'}, {'name': 'Функциональное тестирование'}]",Условия: Пересмотр ЗП каждые 3 месяца;<br />Официальное трудоустройство;<br />Удаленный формат работы;<br />Гибкое начало рабочего дня;<br />Интересные задачи и профессиональную самореализацию с возможностью роста.
12520,12520,,Mehen Games,,"Обязанности: Собирать игровые уровни в Unity 2D, готовить и добавлять новые ассеты в игруОптимизация графики для 2D игр для мобильных платформВносить технические исправления в готовый графический контент (в Adobe Photoshop)Готовить исходные файлы для внедрения в игру, проверять их соответствие документацииВзаимодействие с иллюстраторами, аниматорами и разработчиками ",Частичная занятость,От 1 года до 3 лет,50000.0,40000.0,Младший Технический художник / Junior Technical Artist (Gamedev),2020-10-14T15:42:01+0300,"Требования: Знание и опыт работы с Adobe PhotoshopЗнание и опыт работы с UnityОпыт в аналогичной должности со таким же кругом обязанностей от 1 годаВнимательность, ответственность, педантичность, любовь к систематизации, желание работать в командеБудет плюсом художественное образование или опыт рисования объектов окружения ",Удаленная работа,"[{'name': 'Adobe Photoshop'}, {'name': 'Unity'}]","Условия: Удаленная работа из любой точки мираОпытная команда, у участников за плечами работа в крупных игровых компаниях на больших проектахСвободный график, работаем на результатФинансовые условия по результатам собеседования"
15029,15029,,modesco,"<em>Привет!</em> <em>Проект Socpublic находится в поисках творческого и активного менеджера, который сможет системно выстроить процессы в интернет-сервисе и организовать работу небольшого коллектива. </em> ",,Полная занятость,От 1 года до 3 лет,50000.0,40000.0,Менеджер интернет-проекта,2020-10-13T16:34:02+0300,,Удаленная работа,"[{'name': 'Управление проектами'}, {'name': 'Управление рисками'}, {'name': 'Тайм-менеджмент'}, {'name': 'Организаторские навыки'}, {'name': 'Оптимизация бизнес-процессов'}, {'name': 'Руководство коллективом'}, {'name': 'Работа в команде'}]",
15448,15448,Москва,Hello.IO,,,Полная занятость,От 1 года до 3 лет,50000.0,40000.0,Младший технический специалист/специалист службы поддержки,2020-10-14T16:22:46+0300,,Полный день,"[{'name': 'Windows 7'}, {'name': 'Mac Os'}, {'name': 'iOS'}]",
16279,16279,Москва,ЛАБИРИНТ,,"Должностные обязанности:  написание запросов, хранимых процедур, функций с использованием T-SQL;  доработка, модификация существующего кода;  участие в разработке, изменении корпоративных приложений (С++);  поддержка и развитие корпоративной базы данных.  ",Полная занятость,Нет опыта,50000.0,40000.0,Программист,2020-10-14T11:51:09+0300,,Гибкий график,[],Условия:  место работы: офис м. Шаболовская/м. Тульская;  график работы: 
17307,17307,Москва,ЛЕО ТЕЛЕКОМ,,"Обязанности: Помощь руководителю проектовВнутреннее и внешние взаимодействие по вопросам, касающимся проекта, официальная переписка с подразделениями и внешними контрагентами, ведение электронного документооборота по проектуПодготовка договоров подрядаПодготовка сопроводительной документации, сертификатов, паспортов к отгрузкам оборудованияОформление заявок на отгрузки, соглосование, контроль исполненияВедение контрольно-регистрационного учета входящих и исходящих документов по проекту, первичной бухгалтерской документацииКоординировать предоставление нужной информации в обусловленные сроки всем участникам проектаDoc control по проектам с проектированиемВыполнение работ по брошюрированию, сканированию и размножению документовВедение протоколов рабочих групп/совещаний ",Полная занятость,От 1 года до 3 лет,50000.0,40000.0,Ассистент отдела управления проектами,2020-10-13T13:36:27+0300,Требования:  Высшее/ Высшее техническое образование  Начальный опыт работы  Опытный пользователь ПК  ,Полный день,"[{'name': 'Инициативность'}, {'name': 'Коммуникабельность'}]",Условия:  график работы с 09 до 18  на территории работодателя полный рабочий деньоформление по ТК РФиспытательный срок 3 месяцавозможны командировки    
825,825,Москва,Белоторг,"Прием входящих звонков и обработка заказов с сайта:Консультирование клиентов по ассортименту магазина, помощь в выборе товара,Согласование условий доставки и оплаты; <em>Ф</em>ормирование заказов клиентов; Требования: Личностные качества: активная жизненная позиция,готовность брать ответственность на себя,внимательность,оперативность,доброжелательность,  Условия: График работы 5/2 с 09:00 до 19:00",,Полная занятость,От 1 года до 3 лет,55000.0,40000.0,Менеджер интернет-магазина,2020-10-01T16:12:22+0300,"Прием входящих звонков и обработка заказов с сайта:Консультирование клиентов по ассортименту магазина, помощь в выборе товара,Согласование условий доставки и оплаты; <em>Ф</em>ормирование заказов клиентов; Требования: Личностные качества: активная жизненная позиция,готовность брать ответственность на себя,внимательность,оперативность,доброжелательность,  Условия: График работы 5/2 с 09:00 до 19:00",Полный день,"[{'name': 'MS Outlook'}, {'name': 'Пользователь ПК'}, {'name': 'Работа в команде'}]","Прием входящих звонков и обработка заказов с сайта:Консультирование клиентов по ассортименту магазина, помощь в выборе товара,Согласование условий доставки и оплаты; <em>Ф</em>ормирование заказов клиентов; Требования: Личностные качества: активная жизненная позиция,готовность брать ответственность на себя,внимательность,оперативность,доброжелательность,  Условия: График работы 5/2 с 09:00 до 19:00"
3561,3561,,Joom,"Joom — международный мобильный маркетплейс, самый быстрорастущий e-Commerce сервис Европы. Первую версию приложения мы запустили летом 2016-го года, к текущему моменту его скачали более 300 миллионов человек со всего мира. Бизнес компании построен вокруг работы с миллионами пользователей по всему миру. Мы ищем ещё одного агента поддержки пользователей наших мобильных приложений и веб-сервисов со свободным письменным греческим языком. Если вам интересно помогать людям находить удобные им способы совершать покупки, взаимодействовать в мультиязычной и мультикультурной среде, находить простые и эффективные решения сложных проблем, приходите к нам работать! ",,Полная занятость,От 1 года до 3 лет,55000.0,40000.0,Агент службы поддержки со знанием греческого языка,2020-10-09T11:09:50+0300,,Удаленная работа,"[{'name': 'Письменный перевод'}, {'name': 'Грамотность'}, {'name': 'Грамотная речь'}, {'name': 'Русский язык'}, {'name': 'Греческий язык'}]",Условия работы:  Сотрудничество по договору ГПХ на условиях самозанятости (мы компенсируем налоги и взносы в Пенсионный фонд).  Почасовая оплата — 300 рублей/час (выплаты дважды в месяц или раз в месяц). 
4654,4654,Москва,ЕАС ТЕХ,,Обязанности: Техническое сопровождение подрядных организаций.Активный поиск подрядный организаций в регионах.Работа с существующими подрядными организациями.Ведение деловой переписки.Сбор информации от подрядчика о состоянии объекта.Организация работ на объекте.Оформление договоров.Контроль соблюдение сроков выполнение работ на объекте. ,Полная занятость,От 1 года до 3 лет,55000.0,40000.0,Инженер службы технической поддержки,2020-10-15T14:14:53+0300,Требования: Положительный опыт работы с подрядными организациями.Высокая коммуникабельность.Высокий порог ответственности.нацеленность на результат.Стрессоустойчивость. ,Полный день,"[{'name': 'Деловая переписка'}, {'name': 'Пользователь ПК'}, {'name': 'Деловое общение'}, {'name': 'Документальное сопровождение'}]","Условия: Оклад 40000 + бонус по результату закрытия месяца.Работа в комфортабельном офисе.Обучение, тренинги.Полная занятость, график работы 5/2.Оформление по ТК РФ."
