,Unnamed: 0,city,company_name,description,duty,employment,experience,max_salary,min_salary,name,published_date,requirements,schedule,skills,terms
6205,6205,,Hunt For You,Ищем для геймдев команды Middle\Senior программиста Unity/C# ,"Обязанности:  Программирование ядра игры;  Программирование игровых механик и логики;  Программирование UI и визуальных эффектов;  Оптимизирование ресурсов игры;  Профилирование и оптимизация игры по памяти и fps; работа с SDK сторонних сервисов;  Разработка вспомогательных инструментов (редакторов уровней, карт, эффектов, различных утилит).  ",Полная занятость,От 3 до 6 лет,,,middle\senior unity/c# разработчик,2020-09-16T13:32:21+0300,"Требования:  Опыт работы на Unity3D (С#) опыт разработки на С# от 3 лет;  Отличное знание Unity и всех её подсистем;  Уверенные знания по работе с системой контроля версий git;  Знание ООП, базовых алгоритмов и структур данных;  Знание технического английского языка;  Ответственность, самостоятельность, умение работать в команде;  Приветствуется опыт игровой разработки, опыт разработки для платформ iOS или Android;   Будет плюсом: - Плюсом будет опыт игр новелл и мач3; - Умение работать с анимациями (Animator); - Умение работать с JIRA; - Опыт работы с системами аналитики (DevToDev, Unity Analytics, FireBase); - Умение работать с &quot;чужим&quot; кодом.  ",Удаленная работа,"[{'name': 'Unity'}, {'name': 'C#'}, {'name': 'ООП'}, {'name': 'Git'}, {'name': 'Atlassian Jira'}, {'name': 'iOS'}]",Условия:  Уровень заработной платы готовы обсуждать;  Удаленная работа;  Работа в команде единомышленников;  В перспективе возможность возглавить команду разработки. 
6279,6279,,Ozon,,,Полная занятость,От 1 года до 3 лет,,,c# разработчик (логистика),2020-09-22T11:23:58+0300,,Полный день,"[{'name': '.NET Framework'}, {'name': 'MS SQL'}, {'name': 'SQL'}, {'name': 'C#'}, {'name': 'IT'}]",
6350,6350,Москва,АЙФЭЛЛ,,Обязанности: Разработка интернет-банкинга (ДБО) для группы СМП банков (50 000+ активных пользователей);Разработка интернет-сайта smpbank.ru. ,Полная занятость,От 3 до 6 лет,,,c# developer,2020-10-06T16:42:15+0300,"Требования: Уверенное владение C#, платформа .NET 4+/Core 3+;Опыт работы с Entity Framework;MS SQL на уровне написания эффективных хранимых процедур/функций, понимание транзакционной логики, опыт анализа планов выполнения и оптимизации запросов. ",Полный день,"[{'name': 'Entity Framework'}, {'name': 'Agile Project Management'}, {'name': 'SQL'}, {'name': 'Git'}, {'name': 'C#'}, {'name': 'MS SQL'}, {'name': 'RabbitMQ'}]",
6716,6716,,"Всероссийский научно-исследовательский институт автоматики им. Н.Л. Духова, ФГУП","Требования профильное высшее образованиеопыт промышленной разработки на C# от 1 годаWinForms, WPF, DevExpress, ADO.NET, LINQ, async/await, Fastreport.владение принципами построения архитектуры клиент-серверных системпонимание принципов ООП, шаблонов проектирования, MVC, MVP, MVVM, IoCзнание SQL, умение проектировать структуру базы данных, писать хранимые процедурывладение ORM-инструментами (EntityFramework, NHibernate)умение разбираться в чужом кодетехнический английский языккоммуникабельностьопыт работы в командежелание учиться и развиваться в профессиональной сфере Плюсом будет опыт участия в разработке сложных корпоративных системопыт работы с Oracle и PL/SQL или PostgreSQLзнания в области ASP.NET MVC, JavaScript, HTMLзнания в области Javaопыт разработки web-приложений Обязанности сопровождение существующих программных модулей и разработка новыхтестирование разработанного функционаланастройка пользовательских интерфейсов системы и расширение функциональностиреализация отчетовнаписание проектной документации","Требования профильное высшее образованиеопыт промышленной разработки на C# от 1 годаWinForms, WPF, DevExpress, ADO.NET, LINQ, async/await, Fastreport.владение принципами построения архитектуры клиент-серверных системпонимание принципов ООП, шаблонов проектирования, MVC, MVP, MVVM, IoCзнание SQL, умение проектировать структуру базы данных, писать хранимые процедурывладение ORM-инструментами (EntityFramework, NHibernate)умение разбираться в чужом кодетехнический английский языккоммуникабельностьопыт работы в командежелание учиться и развиваться в профессиональной сфере Плюсом будет опыт участия в разработке сложных корпоративных системопыт работы с Oracle и PL/SQL или PostgreSQLзнания в области ASP.NET MVC, JavaScript, HTMLзнания в области Javaопыт разработки web-приложений Обязанности сопровождение существующих программных модулей и разработка новыхтестирование разработанного функционаланастройка пользовательских интерфейсов системы и расширение функциональностиреализация отчетовнаписание проектной документации",Полная занятость,От 3 до 6 лет,,,разработчик c#,2020-10-06T15:14:22+0300,"Требования профильное высшее образованиеопыт промышленной разработки на C# от 1 годаWinForms, WPF, DevExpress, ADO.NET, LINQ, async/await, Fastreport.владение принципами построения архитектуры клиент-серверных системпонимание принципов ООП, шаблонов проектирования, MVC, MVP, MVVM, IoCзнание SQL, умение проектировать структуру базы данных, писать хранимые процедурывладение ORM-инструментами (EntityFramework, NHibernate)умение разбираться в чужом кодетехнический английский языккоммуникабельностьопыт работы в командежелание учиться и развиваться в профессиональной сфере Плюсом будет опыт участия в разработке сложных корпоративных системопыт работы с Oracle и PL/SQL или PostgreSQLзнания в области ASP.NET MVC, JavaScript, HTMLзнания в области Javaопыт разработки web-приложений Обязанности сопровождение существующих программных модулей и разработка новыхтестирование разработанного функционаланастройка пользовательских интерфейсов системы и расширение функциональностиреализация отчетовнаписание проектной документации",Полный день,"[{'name': 'C#'}, {'name': 'Oracle Pl/SQL'}, {'name': 'WPF'}, {'name': 'JavaScript'}, {'name': 'SQL'}]",
6899,6899,Москва,Altenar,"<em>Altenar</em><em> — международная IT</em><em> B</em><em>2B</em><em> компания с офисами в России, на Мальте и в Греции, которая занимается разработкой высоконагруженного программного обеспечения для сбора, обработки, анализа спортивных данных в реальном времени и их последующего преобразования в информацию для наших B</em><em>2B</em><em> клиентов.</em> ",,Полная занятость,От 3 до 6 лет,,,старший разработчик .net c#,2020-10-14T11:39:36+0300,,Удаленная работа,"[{'name': 'Английский язык'}, {'name': '.Net Core'}, {'name': '.Net'}, {'name': 'C#'}]",
7002,7002,Москва,Лаборатория Безопасных Систем,"Компания «Лаборатория Безопасных Систем» с 2015 года успешно работает в области разработки и верификации программного обеспечения для медицинской промышленности, которое отвечает западным стандартам – safety-critical software.<br /><br />В связи с расширением штата, мы с нетерпением ждем в свою команду Unity 3D/C# разработчика уровня Middle и выше для участия в зарубежном проекте по разработке разнообразных приложений для медицинского лабораторного оборудования. ",,Полная занятость,От 3 до 6 лет,,,middle unity3d/c# разработчик,2020-10-12T20:25:53+0300,,Гибкий график,"[{'name': 'Unity3D'}, {'name': 'C#'}, {'name': 'Английский язык'}]",
7012,7012,Москва,1С-СофтКлаб,<em>,"Обязанности:</em> Разработка и поддержка веб-приложений в рамках проектов компанииРеализация механизмов обмена данными между компонентами корпоративной информационной системы и внешних партнеровУчастие в разработке, согласовании и управлении требованиями к системамПроектирование БД, бизнес-логики и пользовательского интерфейса <em>",Полная занятость,От 3 до 6 лет,,170000.0,"разработчик c#, asp.net",2020-10-13T11:23:18+0300,"Обязанности:</em> Разработка и поддержка веб-приложений в рамках проектов компанииРеализация механизмов обмена данными между компонентами корпоративной информационной системы и внешних партнеровУчастие в разработке, согласовании и управлении требованиями к системамПроектирование БД, бизнес-логики и пользовательского интерфейса <em>",Полный день,[],"Условия:</em> Оформление по ТК РФПривлекательный социальный пакет (ДМС, фитнес-клубы)Работа на территории компанииМ.ПавелецкаяГрафик работы: с 9.45 до 18.30, 5/2."
7067,7067,,Брокеркредитсервис,"В &quot;Мир Инвестиций&quot; БКС мы ищем Ведущего С#/.Net Core разработчика. Мы предоставляем онлайн-доступ к уникальной линейке продуктов и экспертизе БКС – инвестиционного дома № 1 в России. Наши диджитал-решения являются катализатором разработки новых продуктов для инвесторов. В «Мире инвестиций» веб и мобайл – это единое пространство, созданное для удобства пользователя. Мы ориентируемся на бизнес-результат и ищем специалистов, готовых выпускать качественный продукт. ",,Полная занятость,От 1 года до 3 лет,,,c#/.net core developer,2020-10-06T11:31:33+0300,,Полный день,"[{'name': 'MS SQL'}, {'name': 'Scrum'}, {'name': 'C#'}, {'name': 'SQL'}, {'name': 'REST API'}, {'name': 'Kubernetes'}]","За что предложим справедливую компенсацию: Оформление в соответствии с ТК РФ - все по правилам порядочных работодателей;Комфортный офис в 7 мин. от м. Проспект Мира;Возможность принять участие в трансформации международной компании - крупнейшего игрока на инвестиционном рынке России;Возможность участия в профильных конференциях и тренингах за счет Компании;Гибкий график работы - ориентируемся на продуктивность;ДМС по льготным условиям;Минимум бюрократии и отсутствие дресс-кода;Профессиональная сильная команда, современные технологии;Мощное железо (макбуки или стационарные компьютеры, дополнительные мониторы);Уютная столовая, кофейня и вендинги;Корпоративные скидки для языковых курсов и фитнес-клубов;Спортивные команды по футболу и хоккею, квиз-турниры;Специальные предложения от БКС Банка."
7095,7095,Москва,Акуматика,Компания Acumatica ищет ,,Полная занятость,От 3 до 6 лет,,,ведущий разработчик c#,2020-09-20T15:12:43+0300,,Полный день,"[{'name': '.NET Framework'}, {'name': 'Git'}, {'name': 'MS SQL Server'}, {'name': 'C#'}, {'name': 'ERP'}, {'name': 'ASP.NET'}]",
7178,7178,,Большие числа,Мы создаем веб-платформу для онлайн образования и онлайн консультаций. Нужен опытный разработчик ASP NET MVC C#. Ожидаемый объем работы: 200-1000 часов. После выполнения проекта планируем поддержку и развитие.   ,,Проектная работа,От 3 до 6 лет,1000000.0,300000.0,разработчик asp net mvc c# на проект,2020-10-12T15:24:15+0300,"Требования: опыт работы ASP NET MVC C# от 3х лет;желателен опыт в области WebRTC, биллинга. ",Удаленная работа,"[{'name': 'ASP.NET'}, {'name': 'C#'}, {'name': 'ASP.NET MVC'}, {'name': 'MVC'}, {'name': 'Консультирование'}]","Условия: удаленная работа, свободный график;оплата по результатам работ"
7509,7509,,LATOKEN,LATOKEN’s mission is to ,,Полная занятость,От 3 до 6 лет,270000.0,200000.0,product developer c#,2020-10-11T11:32:19+0300,,Удаленная работа,[],
7550,7550,Москва,Renaissance Capital,Инвестиционный банк Ренессанс Капитал ищет ,"Обязанности:  Разработка и поддержка Web-приложений, Web и Windows сервисов: Участие в разработке и поддержке систем обработки статических данных и биржевых котировок по финансовым инструментам;Систем подготовки регуляторной отчетности (Transaction Reporting);Систем автоматизации отдела Research.   ",Полная занятость,От 3 до 6 лет,240000.0,,.net (c#) developer \ ( ведущий) разработчик .net (c#),2020-10-13T09:01:07+0300,"Требования к квалификации:  Высшее техническое образованиеЗнание архитектурных принципов построения ИТ-системПрофессиональное владение технологиями, протоколами и продуктами: C#, Microsoft .NETMicrosoft SQL Server, ADO.NETXML, HTTP, HTML, CSS, XSLT, JSON    ",Полный день,"[{'name': 'ASP.NET'}, {'name': 'jQuery'}, {'name': 'MVC'}, {'name': '.NET Framework'}, {'name': 'SQL'}, {'name': 'C#'}]","Условия работы: Конкурентная заработная плата;Работа в офисе компании Ренессанс Капитал (Москва-Cити, Пресненская наб., 10, Блок С);Профессиональная команда, интересные задачи, возможность роста;ДМС на сотрудника, супругу и детей и страхование Жизни на сотрудника (с первого рабочего дня)."
7628,7628,Москва,Логистик Тайм,,"Основные обязанности: Создание архитектуры проекта, задание вектора.Принятие технических решений.Постановка задач разработчикам, формирование плана разработки.Контроль качества и сроков выполнения задач.Осуществление код ревью.Коммуникация с менеджментом и другими отделами компании. ",Полная занятость,От 3 до 6 лет,,,team lead/c# developer,2020-10-15T13:02:02+0300,,Полный день,"[{'name': 'MongoDB'}, {'name': 'MySQL'}, {'name': 'Контроль исполнения решений'}, {'name': 'Teamleading'}, {'name': 'Постановка задач разработчикам'}]",
7684,7684,Москва,Северный Центр Позитроники,,,Полная занятость,От 3 до 6 лет,200000.0,150000.0,c# developer (backend),2020-09-30T10:54:07+0300,,Полный день,"[{'name': 'C#'}, {'name': 'ASP.NET MVC'}, {'name': '.NET Core'}, {'name': 'SOLID'}, {'name': 'Docker'}, {'name': 'Kubernetes'}, {'name': '.NET'}, {'name': 'SQL'}, {'name': 'PostgreSQL'}]",
7813,7813,,Ozon,"Исторически архитектура OZON.ru была устроена скорее как у банка, чем у интернет-компании: .Net, C#, MSSQL, вертикальное масштабирование, хранимые процедуры, и т.д. Сейчас мы мигрируем архитектуру в сторону больше похожей на архитектуру интернет-компаний: Linux, микросервисы, горизонтальное масштабирование, highload, отказоустойчивость, распределение нагрузки, etc. Наш идеальный кандидат: Имеет хорошее знание SQL, TSQL (stored procedures, indexes);Имеет опыт работы с MS SQL Server 2012 и выше;Имеет опыт работы с PostgreSQL;Имеет базовое знание C#;Обладает хорошем пониманием предметной области и нужд бизнеса. Что предстоит делать: Разрабатывать микросервисы;Поддерживать и разрабатывать логистические информационные системы;Проектировать базы данных PostgreSQL (10 и выше), MS SQL Server 2017;Перформанс оптимизации БД;Осуществлять написание хранимых процедур, запросов и т.д.",,Полная занятость,От 3 до 6 лет,,,sql developer (c#),2020-10-14T14:40:04+0300,,Полный день,"[{'name': 'MS SQL Server'}, {'name': 'Transact-SQL'}, {'name': 'PostgreSQL'}, {'name': 'it'}, {'name': 'C#'}]",
7826,7826,Москва,ТЕКО,,"Обязанности:<br />— разработка компонентов финансовых сервисов, поддержка существующих, рефакторинг;<br />— 100% задач - бэкенд;<br />— работа в команде с другими бэкендерами, фронтендерами и ПМами;<br /><br />",Полная занятость,От 1 года до 3 лет,100000.0,70000.0,junior c# developer,2020-09-16T16:07:03+0300,,Полный день,"[{'name': 'C#'}, {'name': '.NET Framework'}, {'name': 'ASP.NET'}, {'name': 'LINQ'}, {'name': 'Entity Framework'}, {'name': 'SQL'}]",Условия:<br />— официальное трудоустройство c первого рабочего дня;<br />— белая заработная плата;<br />— современный и комфортный офис в 10 минутах от метро Автозаводская;<br />— график работы 5/2 с 10.00 до 19.00 (возможен гибкий график).
7882,7882,,ИНВИТРО,,,Полная занятость,Более 6 лет,,150000.0,ведущий программист c#,2020-10-06T10:54:43+0300,,Полный день,"[{'name': 'SQL'}, {'name': 'WCF'}, {'name': 'Entity Framework'}, {'name': 'ASP.NET'}, {'name': 'MVC'}, {'name': 'jQuery'}, {'name': 'C#'}]","Условия: Оклад обсуждаем на встречеКомфортный график (возможность выбора начала рабочего дня)Офис в пяти минутах пешком от м. Нагатинская (есть парковка)Дополнительные 3 дня отпуска к основному отпуску 28 днейКорпоративные скидки на услуги компании: 30 % скидки на анализы, УЗИ и прием профильных специалистов для Вас и членов семьи"
