,Unnamed: 0,city,company_name,description,duty,employment,experience,max_salary,min_salary,name,published_date,requirements,schedule,skills,terms
11603,11603,,DCloud,На один из проектов онлайн платежной системы https://payler.com ищем C#-разработчика уровня senior/тимлид ,,Полная занятость,От 3 до 6 лет,200000.0,170000.0,ведущий разработчик c#,2020-10-12T13:55:54+0300,"Требования опыт в коммерческой разработке программного обеспечения не менее пяти летопыт проектирования программной архитектуры высоконагруженных проектовзнания С# (.NET Frameworke, .NET Core)знания и опыт работы как с SQL базами данных (MySQL, MSSQL), так и NoSQL (MongoDB, Redis)знание и опыт работы ASP.NET ",Удаленная работа,"[{'name': 'C#'}, {'name': 'MongoDB'}, {'name': 'Teamleading'}, {'name': 'ASP.NET'}]","Условия стабильную зарплату по результатам собеседованияоформление по ТК РФгибкий график работыинтересные, творческие задачи Будем рады пообщаться и предоставить интересующую Вас информацию"
11605,11605,,Документовед,В SaaS стартап требуется разработчик С# ,"Обязанности: У нас есть два фронта работ: Серверная разработка на ASP.NET MVС C#, EF, Dapper, IoC, WCFРабота над собственным фреймворком на JavaScript   ",Полная занятость,От 1 года до 3 лет,,130000.0,разработчик c# asp .net,2020-10-15T17:06:07+0300,"Требования: Опыт программирования на ASP.NET MVC + C# + MSSQLОпыт вёрстки, написания стилей, программирования на JavaScript   ",Удаленная работа,"[{'name': 'C#'}, {'name': '.NET Framework'}, {'name': 'ASP.NET'}, {'name': 'MS SQL'}, {'name': 'MVC'}, {'name': 'jQuery'}, {'name': 'JavaScript'}, {'name': 'LINQ'}]","Условия: Работаем в небольшом коллективе по SCRUM методологииИнструменты VS2015, SVN, Confluence/Jira, Continuous IntegrationСопровождение нескольких внутренних и внешних проектовВозможна удалённая работа"
11759,11759,,Технопарк,,"Обязанности: Проектирование и разработка приложенийДоработка, поддержка существующих бизнес приложений компанииПроектирование БД, написание запросов и хранимых процедур<br />MSSQLРефакторинг и оптимизация кодаРабота с командой, участие в митингах, обсуждение задач <br />",Полная занятость,От 1 года до 3 лет,,170000.0,senior c# разработчик,2020-09-24T10:53:27+0300,"Требования: Наличие высшего технического образованияОпыт командной разработки ПО в роли backend разработчика от 3<br />летУверенное знание: MSSQL, TSQL, C#, ASP.NETОпыт написания тестовВладение английским языком на уровне чтения технической<br />документацииПерфекционизм, аккуратность, трудолюбие, желание развиваться <br />",Удаленная работа,[],"Условия: Вознаграждение от 170 000 руб., обсуждается индивидуально с<br />кандидатом по результатам собеседованияГрафик работы с 817Работа в дружном и профессиональном коллективеПерспективы профессионального ростаУдаленная работаОплачиваемые переработки"
11889,11889,,"ОВЕН, Производственное объединение",,,Полная занятость,От 1 года до 3 лет,150000.0,100000.0,c# разработчик,2020-10-12T07:33:37+0300,,Полный день,"[{'name': 'C#'}, {'name': '.NET Framework'}, {'name': 'SOLID'}, {'name': 'Unit Testing'}, {'name': 'Design Patterns'}, {'name': 'Windows Forms'}]",
11997,11997,Москва,ПАЛИТРА СИСТЕМ,"В команду разработчиков программного обеспечения для автоматизации метрологических служб (АСУ МС, АРМ Метролог) требуется Разработчик С# с опытом коммерческой разработки/ В сопроводительном письме ОБЯЗАТЕЛЬНО указывайте ссылку на профиль в GitHub.  ",Обязанности: Проектирование и разработка приложений в соответствии со стандартом Проекта;Поддержка и развитие существующих приложений;Работа в команде с другими разработчиками;Работа в системах управления проектами Jira Software и DevOps ,Полная занятость,От 1 года до 3 лет,,,программист c#,2020-10-13T20:49:30+0300,Требования: ,Гибкий график,"[{'name': 'WPF'}, {'name': 'C#'}, {'name': 'Atlassian Jira'}, {'name': '.NET Framework'}, {'name': 'ADO.NET'}]",Условия: Трудоустройство в соответствии с ТК РФ;
12075,12075,,ZennoLab,"Мы занимается разработкой продуктов и решений для SEO с 2008 года. В данный момент у нас десятки тысяч клиентов из 88 стран мира и мы не собираемся на этом останавливаться. Несмотря на большое количество клиентов и широкую известность среди SEO специалистов, в ZennoLab работает около 30 человек. Это значит, что ты не будешь чувствовать себя маленьким винтиком в большой системе - наоборот, сможешь видеть, как результатами твоей работы пользуются тысячи людей! ",,Полная занятость,Более 6 лет,200000.0,160000.0,senior backend developer .net c#,2020-10-13T11:51:35+0300,Требования к соискателям: Опыт работы с C# от 6 летОпыт разработки на ASP.Net MVC / Core от 3 летОпыт работы с SQL и/или NoSQL БДБольшим плюсом будет опыт работы с ASP.NET Web Forms ,Удаленная работа,[],
12285,12285,,Лаборатория Касперского,,,Полная занятость,От 1 года до 3 лет,,,software development engineer in test (c#),2020-09-25T16:31:37+0300,,Полный день,[{'name': 'C#'}],
12546,12546,Москва,НефтеТрансСервис,"«НефтеТрансСервис» ищет в свою команду ведущего разработчика для создания новой корпоративной информационной системы на стеке продуктов MS SQL Server, .NET/C# ",Ваши обязанности: Участие в разработке новых модулей информационной системы;Доработка и сопровождение существующих модулей;Внутренне тестирование и отладка;Описание изменений. ,Полная занятость,Более 6 лет,,,"ведущий разработчик (c#, .net)",2020-10-08T12:24:11+0300,,Полный день,"[{'name': 'C#'}, {'name': 'Windows Forms'}, {'name': '.NET Framework'}, {'name': 'MS SQL Server'}, {'name': 'MS SQL'}]",
12580,12580,,Адам Код,"  На перспективу, мы готовы рассмотреть разработчиков и ниже уровнем, чем в вакансии. ","Обязанности:  Прохождение Стажировки (Обучение 1ый этап)  Активное развитие, погружение в технологии и проекты  Работа Младшим разработчиком на проекте  Написание кода  Тестирование  ",Полная занятость,От 1 года до 3 лет,,,c# .net mvc developer junior/стажер (россия),2020-10-05T17:48:14+0300,"Требования:  Опыт работы с C# .NET  SQL  JS, Html, CSS  Опыт разработки клиент-серверных приложений  Хороший, надежный, трудолюбивый человек, готовый работать с самоотдачей  ",Удаленная работа,[],Условия:  Работа удаленно  Конкурентоспособная заработная плата  График работы 5/2  Полная занятость    
12624,12624,,СтандартПроект,"Привет, мы в СтандартПроекте ищем Middle+ C# .NET разработчика. Делаем для Департамента транспорта Москвы систему по управлению сотнями машин в режиме реального времени и собственное приложение для назначения заданий водителям. Также в нашу эко-систему продуктов входит ещё аналитика с алгоритмизацией создания эффективных маршрутов.<br />У нас много работы с данными телеметрии машин, построением эффективных маршрутов и сложной бизнес-логики. Работа на удаленке, вся коммуникация через Zoom и Rocketchat, трекинг задач в Jira.<br />Работаем по Scrum двухнедельными спринтами. ",,Полная занятость,Нет опыта,,,middle+ c# .net разработчик,2020-10-12T18:21:11+0300,,Удаленная работа,"[{'name': 'PostgreSQL'}, {'name': 'ASP.NET'}, {'name': '.NET Framework'}]",
12668,12668,Москва,Positive Technologies,,,Полная занятость,От 1 года до 3 лет,,,c# разработчик (maxpatrol siem),2020-10-09T08:58:46+0300,,Полный день,[],
12813,12813,,Инжиниринговый Центр МФТИ по полезным ископаемым,,,Полная занятость,От 1 года до 3 лет,,,программист c# (unity3d),2020-09-28T13:09:05+0300,,Полный день,"[{'name': 'C#'}, {'name': 'Unity'}, {'name': 'Английский язык'}, {'name': 'Работа в команде'}, {'name': 'Обучение и развитие'}]",
12846,12846,Москва,CUSTIS,"Компания CUSTIS специализируется на проектировании, разработке и развитии масштабных информационных систем. На протяжении более 20 лет мы реализуем сложные проекты по трансформации бизнеса наших клиентов – лидеров отраслей, используя инновационные подходы к проектированию и современные технологические платформы. Для одной из крупнейших розничных торговых сетей наша команда создала набор решений, который охватывает значительную часть ИТ-ландшафта клиента. Уже более 10 лет мы продолжаем успешное развитие каждой ИТ-системы, обеспечивающей функционирование основных процессов ритейлера, связанных с учетом и перемещением товаров. Наши системы позволяют осуществлять управление товарным запасом в более чем 1500 магазинов, обеспечивают товародвижение и документооборот на территории РФ и в других странах присутствия для всех каналов реализации товара. ",,Полная занятость,От 1 года до 3 лет,,,старший разработчик c# (логистика),2020-09-29T09:48:17+0300,,Полный день,[],
12848,12848,,BASYS,,"Обязанности: Разработка и построение архитектуры решений для Microsoft Dynamics CRM, WEB приложений, кастомного UIРазработка и построение интеграционных решенийУчастие в разработке аналитических и предиктивных моделей прогнозированияСоздание и управление командой разработчиков ",Полная занятость,От 1 года до 3 лет,,,"программист dynamic crm, c#, ai, ml, ведущий разработчик / архитектор",2020-10-13T14:23:49+0300,"Требования: Опыт разработки и построения архитектуры для Microsoft Dynamics CRM от 3-х лет, уверенное знание платформы и способов кастомизации Хорошее знание C#, ASP.NET MVC, WebAPI, JScript, JQuery, HTML, CSS, WCF Опыт работы с MS SQL 2012+, хорошее знание T-SQL, разработка и оптимизация запросов, хранимых процедур, функций. Опыт проектирования приложений/информационных систем Владение ООП, шаблонами проектирования. Базовые знания Power BI, Azure Machine Learning.",Удаленная работа,"[{'name': 'C#'}, {'name': '.NET Framework'}, {'name': 'MVC'}, {'name': 'HTML'}, {'name': 'MS Dynamics CRM'}, {'name': 'Visual Studio C#'}, {'name': 'SQL'}, {'name': 'ASP.NET'}, {'name': 'jQuery'}]",Условия: Удаленная работаГибкий графикМотивация от бонусов до опциона в бизнесеРассматриваем кандидатов разных уровней и компетенций
12999,12999,,КОРУС Консалтинг,,<em>Обязанности:</em> реализация доработок к MS CRM согласно ТЗ;доработка существующих решений;настройка и администрирование MS CRM;соблюдение сроков и качества выполняемой работы. <br />,Полная занятость,От 3 до 6 лет,,,"ведущий разработчик microsoft dynamics crm (c#, asp.net )",2020-10-13T10:31:25+0300,"<em>Требования:</em> знание C#, ASP.NET;знание JavaScript, jQuery;знание JS-фреймворков: Angular.js, React.js;глубокие знания Microsoft SQL Server и T-SQL;опыт работы с WEBAPI/WEB/WCF сервисами;администрирование IIS;знание английского языка (на уровне чтения технической документации). <br />",Полный день,"[{'name': 'C#'}, {'name': 'ASP.NET'}, {'name': 'MS SQL'}, {'name': 'IIS'}, {'name': 'JavaScript'}, {'name': 'MS Dynamics CRM'}, {'name': 'CRM'}, {'name': 'jQuery'}]","<em>Условия:</em> работа в стабильной, известной на рынке компании;участие в крупных амбициозных проектах;благоприятные условия для быстрого профессионального и карьерного роста, приятный коллектив;ДМС, страхование выезжающих за границу, выгодные условия страхования для родственников;корпоративные мероприятия;оформление по ТК РФ, &quot;белая&quot; заработная плата (обсуждается с успешными кандидатами индивидуально).  "
13010,13010,Москва,Ду Ду Геймз,Международная компания ,,Полная занятость,От 1 года до 3 лет,,,unity c# developer / программист (meta),2020-10-12T23:28:49+0300,,Удаленная работа,"[{'name': 'C#'}, {'name': 'STL'}, {'name': 'ООП'}, {'name': 'Unity'}]",
13082,13082,Москва,ФОРС,,"Обязанности: Участие в проектах разработки программного обеспечения с использованием технологии C# и платформы .NET;Руководство группой разработчиков на проекте – распределение задач, контроль сроков и качества выполнения;Участие в подготовке проектной документации;Участие в выработке технологических решений и регламентов разработки программного обеспечения с использованием технологии C# и платформы .NET;Проектирование архитектуры приложений на основании требований к программным средствам;Экспертиза и контроль качества C# кода (в рамках проектной деятельности подразделения). ",Полная занятость,От 3 до 6 лет,,,ведущий c# разработчик,2020-10-02T18:07:55+0300,"Требования: Высшее образование;Экспертные знания C#, .NETУверенное знание следующих технологий: ASP.NET MVC, ASP.NET Core, EF, NHibernateПонимание принципов работы СУБДБазовые знания JavaScript, HTML5, CSS, желательно опыт использования ReactСпособность хорошо разбираться в чужом кодеОпыт применения TDD, CIОпыт использования .NET в различных задачах (desktop, web, services, IoT, embed)Опыт управления командой разработчиковКоммуникабельность, готовность работать в команде, а также участвовать в её формировании и развитии.   <br />",Полный день,"[{'name': 'Atlassian Jira'}, {'name': 'Microsoft Visual Studio'}, {'name': 'Cистемы управления базами данных'}, {'name': 'MS Movie Maker'}, {'name': 'Планирование карьеры'}, {'name': 'С#'}, {'name': 'ASP.NET Core'}, {'name': 'ASP.NET MVC'}]","Мы предлагаем: «Белую» заработную плату, оформление по ТК РФ; ДМС, НС - после испытательного срока (3 месяца)+ страховка выезда зарубеж (полис ВЗР); Техника, по выбору; Возможность профессионального и карьерного развития, участие в конференциях; Дополнительный выходной день, в честь дня рождения. Комфортные условия труда; Офис в пешей доступности от метро  Дресс-код: демократичный casual "
13183,13183,,КАШЕМИР И ШЕЛК,"Наша IT команда ведет активную разработку различных IT проектов: учетную ERP систему, ряд Web порталов, служебного софта и много другое. Сейчас мы в поисках талантливого ",,Полная занятость,От 1 года до 3 лет,150000.0,100000.0,разработчик c#,2020-09-24T12:50:49+0300,,Полный день,[],
13196,13196,Москва,ABBYY,<em>,,Полная занятость,От 3 до 6 лет,,,qa engineer (c#),2020-09-18T16:20:50+0300,,Полный день,"[{'name': 'Тестирование'}, {'name': 'C#'}, {'name': 'Java'}]",
13257,13257,,Mongoose,,"Обязанности:  писать крутой код  делать эстимейты (оценивать, сколько времени займёт работа, сколько времени придётся потратить на тот или иной проект), если нет опыта - научим  ",Полная занятость,От 1 года до 3 лет,,,c# developer,2020-09-19T16:44:05+0300,,Удаленная работа,"[{'name': 'Software Development'}, {'name': 'С#'}, {'name': '.NET Framework'}, {'name': 'ООП'}, {'name': 'Solid Works'}, {'name': 'PostgreSQL'}, {'name': 'MySQL'}, {'name': 'ASP.NET'}, {'name': 'Разработка ПО'}]",
13299,13299,Москва,Интэком,,"Обязанности: 2я линия поддержки продукта: взаимодействие с Инженером внедрения, Руководителем Проекта, Программистами, Техническим писателем;Cоздание аналитических отчётов;Дебаг кода (C#, Python);Проработка алгоритмов и решений для продукта;Постановка задач на доработку программного обеспечения программистам через bug tracking;Доработка конфигураций объекта XML. ",Полная занятость,От 3 до 6 лет,,120000.0,"программист c#, аналитик",2020-10-15T19:10:45+0300,"Требования: Опыт работы с C# от 3х лет;Высшее техническое образование;Соблюдение конфиденциальных данных заказчика;Знания SQL;Базовые знания в области механики сплошных сред, течения жидкости и газа; ",Полный день,"[{'name': 'SQL'}, {'name': 'Аналитик'}, {'name': 'C#'}]","Условия:  Полное соблюдение ТК РФ; Гибкий график работы, 40 ч в неделю; Премии по результатам работы за год; Интересные задачи; Карьерный, профессиональный и финансовый рост."
13308,13308,Москва,"СУЭК, Сибирская Угольная Энергетическая Компания",,Обязанности: Разработка приложений / сервисов на C#;Разработка веб-сервисов и веб-страниц на ASP.net.   ,Полная занятость,От 1 года до 3 лет,,,программист c# / .net,2020-10-15T10:56:13+0300,"Требования: Знание С#,ASP,Net, понимание ООП;Опыт работы с Entity Framework, Linq, регулярными выражениями;Знания в области MS SQL (запросы; хранимые процедуры);Опыт командной разработки;Умение разбираться в чужом коде;Приветствуются знания в области работы с ЮЗЭДО (Юридически значимый электронный документооборот)Плюсом будет знание: Java, JavaScript.   ",Удаленная работа,"[{'name': 'C#'}, {'name': 'ASP.NET'}, {'name': 'ООП'}]","Условия: Вакансия открыта в Головном Офисе АО «СУЭК» - лидирующей компании отрасли. Это возможность работать в команде профессионалов и в условиях динамично развивающегося бизнеса. Оформление в соответствии с нормами ТК, социальные гарантии;Полис ДМС (включая стоматологию);Доступ к корпоративной OnLine библиотеке;Обучение в программах Корпоративного университета;Территориальное расположение – станция метро Павелецкая. (Возможность удаленной работы)"
