,Unnamed: 0,city,company_name,description,duty,employment,experience,max_salary,min_salary,name,published_date,requirements,schedule,skills,terms
3054,3054,Москва,ПО Арочные технологии,"  Мы ищем сильного разработчика с экспертным знанием Android, Unity и систем дополненной реальности, в команду инновационного проекта, со стабильным финансированием, находящимся на стадии внедрения. Как и у каждого из нас у него будет полная свобода творчества, гибкий график, сложные и интересные задачи. Главной целью проекта, является ПОЛЕЗНОЕ, ПРАКТИЧНОЕ использование VR/AR дистанционных технологий. Отсутствие скуки гарантируем!!! Обязанности  Участие в проектировании платформы  Разработка и поддержка существующих AR приложений и создание новых  Проведение и прохождение code review  Рефакторинг и устранение технического долга  Тестирование и документация разрабатываемых решений  Требования  Отличное знание C# и Android SDK  Глубокое знание Unity и всех её подсистем  Интеграционное и unit-тестирование (знание, понимание, практика)  Знание структур и алгоритмов обработки данных  Знание и понимание основных паттернов проектирования  Следование в разработке принципам SOLID  Опыт оптимизации приложений по CPU/GPU/памяти  Уверенное владение Git, gitflow  Технический английский язык (чтение документации, проф. литературы, курсы)  Любовь к новым технологиям дополненной и виртуальной реальности, желание и стремление их осваивать и активно применять на практике здесь и сейчас. Будет плюсом  С++ и Python  Основы 3D моделирования  Профильное техническое образование, знание компьютерное графики и связаной математики  Представление о современных средствах командной разработки и CI/CD.  Наличие в портфолио реализованных AR/VR проектов.  Навыки и опыт в разработке шейдеров, оптимизация освещения  Активное участие в OpenSource сообщества и наличие репозитория на github, gitlab и т.д.  Наличие профиля на Habrahabr c публикациями.  Условия  сложные и интересные задачи, быстрый рост и амбициозные цели перед проектом  сильная команда специалистов по разным направлениям  отличная рабочая атмосфера и отсутствие бюрократии  возможность удалённой работы и действительно гибкий график  персональное пространство для самореализации  много свободы, творчества, и… личной ответственности - вклад каждого решающий.       ","  Мы ищем сильного разработчика с экспертным знанием Android, Unity и систем дополненной реальности, в команду инновационного проекта, со стабильным финансированием, находящимся на стадии внедрения. Как и у каждого из нас у него будет полная свобода творчества, гибкий график, сложные и интересные задачи. Главной целью проекта, является ПОЛЕЗНОЕ, ПРАКТИЧНОЕ использование VR/AR дистанционных технологий. Отсутствие скуки гарантируем!!! Обязанности  Участие в проектировании платформы  Разработка и поддержка существующих AR приложений и создание новых  Проведение и прохождение code review  Рефакторинг и устранение технического долга  Тестирование и документация разрабатываемых решений  Требования  Отличное знание C# и Android SDK  Глубокое знание Unity и всех её подсистем  Интеграционное и unit-тестирование (знание, понимание, практика)  Знание структур и алгоритмов обработки данных  Знание и понимание основных паттернов проектирования  Следование в разработке принципам SOLID  Опыт оптимизации приложений по CPU/GPU/памяти  Уверенное владение Git, gitflow  Технический английский язык (чтение документации, проф. литературы, курсы)  Любовь к новым технологиям дополненной и виртуальной реальности, желание и стремление их осваивать и активно применять на практике здесь и сейчас. Будет плюсом  С++ и Python  Основы 3D моделирования  Профильное техническое образование, знание компьютерное графики и связаной математики  Представление о современных средствах командной разработки и CI/CD.  Наличие в портфолио реализованных AR/VR проектов.  Навыки и опыт в разработке шейдеров, оптимизация освещения  Активное участие в OpenSource сообщества и наличие репозитория на github, gitlab и т.д.  Наличие профиля на Habrahabr c публикациями.  Условия  сложные и интересные задачи, быстрый рост и амбициозные цели перед проектом  сильная команда специалистов по разным направлениям  отличная рабочая атмосфера и отсутствие бюрократии  возможность удалённой работы и действительно гибкий график  персональное пространство для самореализации  много свободы, творчества, и… личной ответственности - вклад каждого решающий.       ",Частичная занятость,От 1 года до 3 лет,150000.0,70000.0,middle android developer (c#),2020-10-13T11:57:19+0300,"  Мы ищем сильного разработчика с экспертным знанием Android, Unity и систем дополненной реальности, в команду инновационного проекта, со стабильным финансированием, находящимся на стадии внедрения. Как и у каждого из нас у него будет полная свобода творчества, гибкий график, сложные и интересные задачи. Главной целью проекта, является ПОЛЕЗНОЕ, ПРАКТИЧНОЕ использование VR/AR дистанционных технологий. Отсутствие скуки гарантируем!!! Обязанности  Участие в проектировании платформы  Разработка и поддержка существующих AR приложений и создание новых  Проведение и прохождение code review  Рефакторинг и устранение технического долга  Тестирование и документация разрабатываемых решений  Требования  Отличное знание C# и Android SDK  Глубокое знание Unity и всех её подсистем  Интеграционное и unit-тестирование (знание, понимание, практика)  Знание структур и алгоритмов обработки данных  Знание и понимание основных паттернов проектирования  Следование в разработке принципам SOLID  Опыт оптимизации приложений по CPU/GPU/памяти  Уверенное владение Git, gitflow  Технический английский язык (чтение документации, проф. литературы, курсы)  Любовь к новым технологиям дополненной и виртуальной реальности, желание и стремление их осваивать и активно применять на практике здесь и сейчас. Будет плюсом  С++ и Python  Основы 3D моделирования  Профильное техническое образование, знание компьютерное графики и связаной математики  Представление о современных средствах командной разработки и CI/CD.  Наличие в портфолио реализованных AR/VR проектов.  Навыки и опыт в разработке шейдеров, оптимизация освещения  Активное участие в OpenSource сообщества и наличие репозитория на github, gitlab и т.д.  Наличие профиля на Habrahabr c публикациями.  Условия  сложные и интересные задачи, быстрый рост и амбициозные цели перед проектом  сильная команда специалистов по разным направлениям  отличная рабочая атмосфера и отсутствие бюрократии  возможность удалённой работы и действительно гибкий график  персональное пространство для самореализации  много свободы, творчества, и… личной ответственности - вклад каждого решающий.       ",Удаленная работа,"[{'name': 'Unity'}, {'name': 'Android'}, {'name': 'C#'}]","  Мы ищем сильного разработчика с экспертным знанием Android, Unity и систем дополненной реальности, в команду инновационного проекта, со стабильным финансированием, находящимся на стадии внедрения. Как и у каждого из нас у него будет полная свобода творчества, гибкий график, сложные и интересные задачи. Главной целью проекта, является ПОЛЕЗНОЕ, ПРАКТИЧНОЕ использование VR/AR дистанционных технологий. Отсутствие скуки гарантируем!!! Обязанности  Участие в проектировании платформы  Разработка и поддержка существующих AR приложений и создание новых  Проведение и прохождение code review  Рефакторинг и устранение технического долга  Тестирование и документация разрабатываемых решений  Требования  Отличное знание C# и Android SDK  Глубокое знание Unity и всех её подсистем  Интеграционное и unit-тестирование (знание, понимание, практика)  Знание структур и алгоритмов обработки данных  Знание и понимание основных паттернов проектирования  Следование в разработке принципам SOLID  Опыт оптимизации приложений по CPU/GPU/памяти  Уверенное владение Git, gitflow  Технический английский язык (чтение документации, проф. литературы, курсы)  Любовь к новым технологиям дополненной и виртуальной реальности, желание и стремление их осваивать и активно применять на практике здесь и сейчас. Будет плюсом  С++ и Python  Основы 3D моделирования  Профильное техническое образование, знание компьютерное графики и связаной математики  Представление о современных средствах командной разработки и CI/CD.  Наличие в портфолио реализованных AR/VR проектов.  Навыки и опыт в разработке шейдеров, оптимизация освещения  Активное участие в OpenSource сообщества и наличие репозитория на github, gitlab и т.д.  Наличие профиля на Habrahabr c публикациями.  Условия  сложные и интересные задачи, быстрый рост и амбициозные цели перед проектом  сильная команда специалистов по разным направлениям  отличная рабочая атмосфера и отсутствие бюрократии  возможность удалённой работы и действительно гибкий график  персональное пространство для самореализации  много свободы, творчества, и… личной ответственности - вклад каждого решающий.       "
3131,3131,Москва,Смарт-ком,,"Обязанности: Создание приложения на основе технического задания: составление модели данных, написание бизнес-логики и интерфейса приложения,Тестирование приложения,Сдача приложения в работу,Последующая поддержка работающего приложения, ",Полная занятость,Нет опыта,90000.0,,junior asp.net+c# developer,2020-10-14T10:44:40+0300,Требования: Знание C#.Знание и опыт работы с JavaScript.Понимание принципов ООП. Понимание принципов работы сетевых протоколов прикладного уровня.,Гибкий график,[],Условия: 
3206,3206,,Delecon Holdings Ltd,,,Полная занятость,От 1 года до 3 лет,,,unity c# разработчик,2020-10-14T12:40:30+0300,,Удаленная работа,"[{'name': 'C#'}, {'name': 'Unity'}, {'name': 'WebGL'}, {'name': 'ООП'}, {'name': 'Android'}]",
3232,3232,Москва,Топ Системы,"ЗАО «Топ Системы» является и разработчиком, и поставщиком своих программных решений; основная разработка - программный комплекс T-FLEX PLM. Компания «Топ Системы» обеспечивает полный набор консалтинговых услуг по автоматизации промышленных предприятий - от первоначального анализа процессов и обучения сотрудников до комплексного внедрения в масштабах предприятия. При разработке своих решений ЗАО «Топ Системы» сотрудничает с крупнейшими производителями и поставщиками программного обеспечения Siemens PLM Software, Microsoft, NVidia, а также имеет статус Microsoft Gold Certified Partner в номинации Application Development (разработка приложений). Предлагаем Вам присоединиться к разработчикам отечественной PLM системы! Нашей команде необходимы талантливые, ответственные, способные вдохновлять и вдохновляться нашими задачами единомышленники! ",,Полная занятость,От 3 до 6 лет,,,разработчик .net (c#/wpf),2020-10-08T12:30:50+0300,"Требования:  отличное знание C#, .NET Framework, WinForms, WPF;  опыт разработки клиент-серверных приложений и разработки API;  опыт разработки многопоточных приложений с использованием Task и async/await;  умение разбираться в чужом коде;  умение писать техническую документацию по проделанной работе;  дополнительными плюсами будет: опыт работы с MS SQL, T-SQL, проектирование баз данных, умение систематизировать задачи по важности и срочности исполнения/управлять временем.  ",Гибкий график,"[{'name': 'C#'}, {'name': '.NET Framework'}, {'name': 'WPF'}]","Условия: гибкий график работы;оформление с соблюдением Трудового кодекса Российской Федерации;место работы: район м. Дмитровская, современный комфортный офис в БЦ “Премьер” в 10 минутах ходьбы от станции метро и ж/д станции «Дмитровская»."
3462,3462,Москва,MixCart,"Наша компания занимается очень интересной и глобальной задачей! Мы выбрали гигантский рынок, один из самых больших и важных в стране. Мы работаем над одним большим проектом, основной миссией которого является автоматизация на рынке продуктов питания. MixCart - это, в первую очередь, IT компания, которая развивает свой облачный продукт, в нем много бизнес-логики и много крупных задач, призванных упростить повседневную деятельность наших клиентов. <br />Если тебя влекут грандиозные идеи, интересные задачи и причастность к большим делам, мы ждем тебя. ",Обязанности: Участие в проекте внесения ELMA в составе проектной группыРазработка бизнес-процессовРазработка шаблонов автоматизации документооборота ,Полная занятость,От 1 года до 3 лет,,120000.0,разработчик c#,2020-10-07T13:07:33+0300,"Требования: C#/.NETХорошее понимание парадигмы ООПОпыт работы с GitОпыт разработки новых и доработка существующих бизнес-процессов в ELMA BPMОпыт интеграции ELMA с внешними сервисами (REST, SOAP) ",Полный день,"[{'name': 'Git'}, {'name': 'ООП'}, {'name': 'C#'}, {'name': '.NET Framework'}]",Условия: Проектная работа до 6 месяцевГрафик работы 5/2Комфортный офис в шаговой (5 мин) доступности от м. КотельникиОкончательный уровень заработной платы обсуждается с успешным кандидатомОтдельный open-space Департамента ITЗаработная плата 2 раза в месяц
3484,3484,Москва,Бионика,,,Полная занятость,От 3 до 6 лет,,,senior c# developer,2020-10-15T18:21:14+0300,,Удаленная работа,[],
3833,3833,,Indeed-Id,"Компания «Индид» - российский разработчик программных B2B решений в области информационной безопасности для крупных корпоративных заказчиков, в числе которых: Пенсионный фонд РФ, Новатек, Роснефть, Газпром, Газпром нефть, Альфабанк, Мегафон, МТС, Магнит, Банк ВТБ, Банк «Санкт-Петербург» и другие. <br />Мы разрабатываем линейку продуктов, включающую в себя решения для: обеспечения строгой аутентификации сотрудников компаний (по биометрической модели лица, отпечатку пальца, рисунку вен ладони, смарт-картам, бесконтактным картам, одноразовым паролям и др.), организации единой точки доступа в ОС и приложения (Enterprise Single Sign-On), защиты удаленного доступа, управления жизненным циклом цифровых сертификатов и доступом привилегированных пользователей к важным корпоративным ресурсам. <br />Офисы компании находятся в Санкт-Петербурге, Москве, Великом Новгороде, Вильнюсе и Сингапуре. <br />Подробнее о нас читайте в описании компании.   ",,Полная занятость,От 1 года до 3 лет,130000.0,,middle c# developer asp.net mvc,2020-10-15T17:59:30+0300,,Удаленная работа,"[{'name': 'ASP.NET'}, {'name': 'MVC'}, {'name': 'C#'}, {'name': '.NET Framework'}, {'name': 'HTML'}, {'name': 'JavaScript'}, {'name': 'jQuery'}]",
3885,3885,Москва,Syntellect (ООО СИНТЕЛЛЕКТ),,Обязанности: Разработка и сопровождение программных решений в области автоматизации документооборота на базе платформы TESSA   ,Полная занятость,От 1 года до 3 лет,150000.0,80000.0,программист c#/ .net,2020-10-15T12:18:36+0300,"Требования (обязательные): Высшее\неполное высшее образование в сфере ИТЗнание технологий и опыт работы с C#/ .Net, T-SQLУмение работать в команде   ",Полный день,"[{'name': 'C#'}, {'name': 'Transact-SQL'}, {'name': 'SQL'}, {'name': 'MS SQL'}, {'name': '.NET Framework'}, {'name': 'Разработка ПО'}]",Условия: Профессиональный и карьерный ростОбучение в процессе работыОформление по ТК РФЗаработная плата - по результатам собеседованияБонусная система
